Country,Date,Headline,Link,,,,
Spain,07-Mar,Spain and Portugal holidays could go ahead from May but with strict Covid conditions,https://www.express.co.uk/travel/articles/1406577/spain-portugal-holidays-travel-coronavirus-vaccine-test-entry-rules,,,,
France,07-Mar,"250,000 Covid jabs in France in one day as rollout steps up",https://www.connexionfrance.com/French-news/250-000-Covid-jabs-in-France-in-one-day-as-rollout-steps-up,,,,
France,07-Mar,Fast-spreading Covid-19 variants surge through Europe,https://www.france24.com/en/europe/20210306-fast-spreading-covid-19-variants-surge-through-europe,,,,
France,07-Mar,French government to 'go all out' on vaccination amid COVID variants,https://www.euronews.com/2021/03/06/french-government-to-go-all-out-on-vaccination-amid-covid-variants,,,,
France,07-Mar,"In France, there's no escape from Covid vaccine sceptics. What would Pasteur think?",https://www.theguardian.com/commentisfree/2021/mar/07/in-france-theres-no-escape-from-covid-vaccine-sceptics-what-would-pasteur-think,,,,
France,07-Mar,French medical association says Covid vaccination is an 'ethical duty' for staff,https://www.rfi.fr/en/france/20210306-french-medical-association-says-covid-vaccine-is-an-ethical-duty-for-staff,,,,
UK,07-Mar,Covid-19: Lockdown 'a success' but UK 'not out of the woods',https://www.bbc.com/news/uk-56306105,,,,
UK,07-Mar,Covid: UK must prepare for 'hard winter' of flu - expert,https://www.bbc.com/news/uk-56312621,,,,
UK,07-Mar,"Covid lockdown a success but UK 'not out of the woods', says ONS head",https://www.theguardian.com/world/2021/mar/06/covid-lockdown-a-success-but-uk-not-out-of-the-woods-says-ons-head-coronavirus,,,,
UK,07-Mar,COVID news live: Britons aged 56 and over can now get coronavirus jabs - as government defends 1% NHS pay rise,https://news.sky.com/story/covid-news-live-lockdown-has-been-a-success-but-uk-not-out-of-the-woods-yet-says-ons-chief-12236311,,,,
UK,07-Mar,COVID-19: UK daily deaths dip below 100 for the first time since last October ,https://news.sky.com/story/covid-19-uk-records-another-drop-in-coronavirus-infections-as-number-of-first-jabs-hits-22-2-million-12239145,,,,
Netherlands,01-Mar,"Towards a global green recovery: The cases of Denmark, the EU, Germany, the Netherlands and the UK",https://ecdpm.org/publications/towards-global-green-recovery-cases-denmark-eu-germany-netherlands-uk/,,,,
Netherlands,01-Mar,Newsletter on COVID-19 vaccination issue 8 2021,https://www.rivm.nl/en/covid-19-vaccination/professionals/newsletter/2021/8,,,,
Netherlands,01-Mar,"Covid has ‘taken wind out of Dutch politics’, analysts say as elections loom",https://www.theguardian.com/world/2021/mar/01/covid-has-taken-wind-out-of-dutch-politics-analysts-say-as-elections-loom,,,,
Netherlands,01-Mar,The Netherlands to trial rapid and home coronavirus tests,https://www.iamexpat.nl/expat-info/dutch-expat-news/netherlands-trial-rapid-and-home-coronavirus-tests,,,,
Netherlands,01-Mar,Netherlands 4th in EU ranking for Covid vaccination,https://nltimes.nl/2021/03/01/netherlands-4th-eu-ranking-covid-vaccination,,,,
Italy,01-Mar,Italy tightens covid-19 restrictions in five regions as Sardinia turns 'white',https://www.wantedinrome.com/news/italy-tightens-covid-19-restrictions-in-five-regions-as-sardinia-turns-white.html,,,,
Italy,01-Mar,Italy’s Draghi replaces COVID-19 commissioner with army general,https://www.euractiv.com/section/politics/short_news/italys-draghi-replaces-covid-19-commissioner-with-army-general/,,,,
Italy,01-Mar,"Italy's Draghi fires COVID commissioner, with vaccination drive in spotlight",https://www.reuters.com/article/us-health-coronavirus-italy-commisioner-idUSKCN2AT2U9,,,,
Italy,01-Mar,Sardinia becomes Italy's first COVID 'white zone',https://www.ansa.it/english/news/politics/2021/03/01/sardinia-becomes-italys-first-covid-white-zone_b19944eb-5196-45ba-ae26-035b1011544c.html,,,,
Italy,01-Mar,Italy: Covid-19 – European Commission establishes an authorization mechanism for the export of vaccines,https://globalcompliancenews.com/italy-covid-19-european-commission-establishes-an-authorization-mechanism-for-the-export-of-vaccines-17022021/,,,,
Germany,01-Mar,Germany loses Covid crown as vaccine campaign falters ,https://www.ft.com/content/33f8ffd6-066b-449c-bf7e-edd51d661b19,,,,
Germany,01-Mar,Merkel Faces Growing Pressure to Ease Germany’s Covid Curbs,https://www.bloomberg.com/news/articles/2021-03-01/merkel-faces-growing-pressure-to-ease-germany-s-covid-curbs,,,,
Germany,01-Mar,Germany: COVID-19 vaccination entitlement for expatriates,https://www.pwc.com/gx/en/services/people-organisation/publications/assets/germany-covid-19-vaccination.pdf,,,,
Germany,01-Mar,Germany: Authorities to impose COVID-19 border restrictions for travelers from Moselle Department in France from March 2 /update 33,https://www.garda.com/crisis24/news-alerts/449251/germany-authorities-to-impose-covid-19-border-restrictions-for-travelers-from-moselle-department-in-france-from-march-2-update-33,,,,
Germany,01-Mar,Germany limits travel from French region over virus variant,https://www.ctvnews.ca/health/coronavirus/germany-limits-travel-from-french-region-over-virus-variant-1.5327652,,,,
Spain,01-Mar,Spain: Activists to protest COVID-19 restrictions in Palma de Mallorca March 1,https://www.garda.com/crisis24/news-alerts/449101/spain-activists-to-protest-covid-19-restrictions-in-palma-de-mallorca-march-1,,,,
Spain,01-Mar,Spain: Government extends COVID-19-related closure of border with Portugal until March 16 /update 40,https://www.garda.com/crisis24/news-alerts/449366/spain-government-extends-covid-19-related-closure-of-border-with-portugal-until-march-16-update-40,,,,
Spain,01-Mar,Spain may allow in Covid-vaccinated UK tourists if no EU pass agreed,https://www.theguardian.com/world/2021/mar/01/european-commission-covid-vaccination-pass-proposal-draws-mixed-response-spain-greece-portugal-belgium,,,,
Spain,01-Mar,Spain updates Covid vaccination protocol: under-55s who have recently had virus will only receive one dose,https://english.elpais.com/society/2021-03-01/spain-updates-covid-vaccination-protocol-under-55s-who-have-recently-had-virus-will-only-receive-one-dose.html,,,,
Spain,01-Mar,Spain’s Covid Incidence Continues To Drop,https://www.euroweeklynews.com/2021/03/01/spains-covid-incidence-continues-to-drop/,,,,
France,01-Mar,"France, Germany tighten COVID-19 measures at border",https://www.aa.com.tr/en/europe/france-germany-tighten-covid-19-measures-at-border/2160156,,,,
France,01-Mar,France and Germany to require COVID-19 test for some border crossings,https://www.reuters.com/article/us-health-coronavirus-france-germany-idUSKCN2AS0PC,,,,
France,01-Mar,French public health chief hails efficacy of Covid curfew,https://www.rfi.fr/en/france/20210228-french-public-health-chief-hails-efficacy-of-covid-curfew-lockdown-last-resort,,,,
France,01-Mar,France authorises first synthetic antibody treatment for Covid-19,https://www.rfi.fr/en/science-and-technology/20210228-france-authorises-first-synthetic-antibody-treatment-for-covid-19-monoclonal-eli-lilly-bamlanivimab,,,,
France,01-Mar,Coronavirus digest: Germany to tighten controls at French border,https://www.dw.com/en/coronavirus-digest-germany-to-tighten-controls-at-french-border/a-56727786,,,,
UK,01-Mar,Alarm over delays in border measures as Brazil Covid variant hits UK,https://www.theguardian.com/world/2021/feb/28/person-believed-to-have-brazilian-covid-variant-being-sought-in-england,,,,
UK,01-Mar,Up to six cases of Manaus variant of coronavirus detected in UK,https://www.reuters.com/article/us-health-coronavirus-britain-manaus-idUSKCN2AS0KO,,,,
UK,01-Mar,"COVID-19: New Brazil COVID 'variant of concern' discovered in UK, health officials say",https://news.sky.com/story/covid-19-new-brazil-covid-variant-of-concern-discovered-in-uk-health-officials-say-12231996,,,,
UK,01-Mar,"COVID-19: Another 144 UK deaths and 6,035 new cases reported",https://news.sky.com/story/covid-19-another-144-uk-deaths-and-6-035-new-cases-reported-12231887,,,,
UK,01-Mar,All households with children of school age to get 2 rapid COVID-19 tests per person per week,https://www.gov.uk/government/news/all-households-with-children-of-school-aged-to-get-rapid-covid-19-tests-per-person-per-week,,,,
Netherlands,28-Feb,"Shutdowns, layoffs, virtual tours: How Dutch museums are coping with COVID-19",https://www.pbs.org/newshour/show/shutdowns-layoffs-virtual-tours-how-dutch-museums-are-coping-with-covid-19,,,,
Netherlands,28-Feb,Dutch exceptionalism: Superior failure in the year of coronavirus,https://www.dutchnews.nl/features/2021/02/dutch-exceptionalism-superior-failure-in-the-year-of-coronavirus/,,,,
Netherlands,28-Feb,A year after coronavirus: Dutch say they’re tired and lack confidence in vaccination policy,https://nltimes.nl/2021/02/27/year-coronavirus-dutch-say-theyre-tired-lack-confidence-vaccination-policy,,,,
Netherlands,28-Feb,Covid-19 seven-day average up 17 percent for the week; hospitalizations total also rises,https://nltimes.nl/2021/02/28/covid-19-seven-day-average-17-percent-week-hospitalizations-total-also-rises,,,,
Netherlands,28-Feb,Dutch to roll out rapid breath tests for Covid-19,https://newsinfo.inquirer.net/1400721/dutch-to-roll-out-rapid-breath-tests-for-covid-19,,,,
Italy,28-Feb,Italy tightens COVID restrictions as experts warn of growing prevalence of variants,https://newsinfo.inquirer.net/1400721/dutch-to-roll-out-rapid-breath-tests-for-covid-19,,,,
Italy,28-Feb,Italy tightens COVID-19 curbs in several regions as cases pick up,https://www.reuters.com/article/uk-health-coronavirus-italy-regions-idUKKBN2AR0EL,,,,
Italy,28-Feb,"Italy Tightens Coronavirus Restrictions in Milan, Turin Areas",https://www.bloomberg.com/news/articles/2021-02-27/italy-tightens-coronavirus-restrictions-in-milan-turin-areas,,,,
Italy,28-Feb,Italy tightens Covid-19 curbs in several regions – latest updates,https://www.trtworld.com/life/italy-tightens-covid-19-curbs-in-several-regions-latest-updates-44569,,,,
Italy,28-Feb,Italy tightens COVID-19 curbs in several regions as cases pick up,https://www.livemint.com/news/world/italy-tightens-covid-19-curbs-in-several-regions-as-cases-pick-up-11614433460127.html,,,,
Germany,28-Feb,Trapped in Germany’s COVID nightmare,https://www.politico.eu/article/trapped-in-germany-covid-coronavirus-nightmare/,,,,
Germany,28-Feb,Most Germans keen on COVID vaccination passport,https://www.dw.com/en/most-germans-keen-on-covid-vaccination-passport/a-56723289,,,,
Germany,28-Feb,Covid vaccine: Germany urged to back AstraZeneca jab for over-65s,https://www.bbc.com/news/world-europe-56227171,,,,
Germany,28-Feb,Coronavirus: Experts in warning over COVID's mental health toll on German youth,https://www.euronews.com/2021/02/27/coronavirus-experts-in-warning-over-covid-s-mental-health-toll-on-german-youth,,,,
Germany,28-Feb,Germany to tighten COVID controls at French border,https://www.thelocal.de/20210228/germany-to-tighten-covid-controls-at-french-border/,,,,
Spain,28-Feb,"Czechia Adds Spain, Portugal & Madeira to Its List of COVID-19 High-Risk Countries",https://www.schengenvisainfo.com/news/czechia-adds-spain-portugal-madeira-to-its-list-of-covid-19-high-risk-countries/,,,,
Spain,28-Feb,"Lithuania Imposes Stricter Rules for US Travellers, Eases Rules for Arrivals From Spain & Portugal",https://www.schengenvisainfo.com/news/lithuania-imposes-stricter-rules-for-us-travellers-eases-rules-for-arrivals-from-spain-portugal/,,,,
Spain,28-Feb,"Spain, Portugal lowered to high risk for COVID-19 on new Czech travel map",https://www.expats.cz/czech-news/article/spain-france-lowered-to-high-risk-for-covid-19-on-new-czech-travel-map,,,,
Spain,28-Feb,Effects of climate variables on the COVID-19 outbreak in Spain,https://www.sciencedirect.com/science/article/pii/S1438463921000389,,,,
Spain,28-Feb,Covid survivors may only get one vaccine dose under Spanish proposal,https://www.express.co.uk/news/world/1403245/spain-news-covid-vaccine-Spanish-Silvia-Calzon-AstraZeneca,,,,
France,28-Feb,France steps up Covid rule checks to ‘avoid lockdown’,https://www.connexionfrance.com/French-news/France-steps-up-local-existing-Covid-rule-checks-to-avoid-another-national-lockdown,,,,
France,28-Feb,First report into side-effects of Covid vaccines in France,https://www.connexionfrance.com/French-news/First-report-into-side-effects-of-Covid-vaccines-in-France,,,,
France,28-Feb,France and Poland ratchet up local COVID restrictions amid rising cases,https://www.euronews.com/2021/02/27/france-and-poland-ratchet-up-local-covid-restrictions-amid-rising-cases,,,,
France,28-Feb,Germany tightens Covid controls at French border over variants,https://www.france24.com/en/france/20210228-germany-tightens-covid-controls-at-french-border-over-variants,,,,
France,28-Feb,Six Nations: French sports minister threatens France withdrawal over Covid-19 outbreak,https://www.skysports.com/rugby-union/news/12508/12230246/six-nations-french-sports-minister-threatens-france-withdrawal-over-covid-19-outbreak,,,,
UK,28-Feb,"Covid has connected UK communities and spurred volunteering, report finds",https://www.theguardian.com/world/2021/feb/28/covid-has-connected-uk-communities-and-spurred-volunteering-report-finds,,,,
UK,28-Feb,Covid-19: Nearly 20 million people in UK have first vaccine dose,https://www.bbc.com/news/uk-56224522,,,,
UK,28-Feb,Covid-19: More than 20 million in UK have had first jab,https://www.bbc.com/news/uk-56231518,,,,
UK,28-Feb,Covid-19: Brazil 'variant of concern' detected in UK,https://www.bbc.com/news/uk-56233038,,,,
UK,28-Feb,"UK cases at five-month low; Brazil sees fifth day of more than 1,300 deaths – as it happened",https://www.theguardian.com/world/live/2021/feb/27/coronavirus-live-news-uk-will-face-enormous-strains-says-chancellor-new-zealand-pm-says-auckland-to-go-into-lockdown-for-seven-days,,,,
Netherlands,21-Feb,Dutch parliament overrides court to keep curfew ,https://www.politico.eu/article/netherlands-coronavirus-curfew-parliament-overrides-court-ruling/,,,,
Netherlands,21-Feb,Thousands register for coronavirus-proof concert and festival tickets,https://www.iamexpat.nl/lifestyle/lifestyle-news/thousands-register-coronavirus-proof-concert-and-festival-tickets,,,,
Netherlands,21-Feb,Slight decrease in new covid infections; hospital total also dropped,https://nltimes.nl/2021/02/20/slight-decrease-new-covid-infections-hospital-total-also-dropped,,,,
Netherlands,21-Feb,Participant in Fieldlab experiment tests positive for Covid-19,https://www.theguardian.com/world/2021/mar/07/dutch-clubbers-dance-study-easing-lockdown-music-event-coronavirus,,,,
Netherlands,21-Feb,Dutch senators approve new COVID curfew law in spite of court ruling striking it down ,https://www.euronews.com/2021/02/20/dutch-senators-approve-new-covid-curfew-law-in-spite-of-court-ruling-striking-it-down,,,,
Italy,21-Feb,"After a year of death and solitude, Italy is a sober, serious place",https://www.theguardian.com/world/2021/feb/21/after-a-year-of-death-and-solitude-italy-is-a-sober-serious-place,,,,
Italy,21-Feb,Italian doctors remember night that ushered in Europe's first COVID-19 lockdown,https://www.reuters.com/article/us-health-coronavirus-italy-first-doctor-idUSKBN2AK0BA,,,,
Italy,21-Feb,Codogno: Italy's COVID-19 epicenter one year on,https://www.dw.com/en/codogno-italys-covid-19-epicenter-one-year-on/av-56636207,,,,
Italy,21-Feb,Italy pays tribute to health workers as nation marks covid-19 anniversary,https://www.wantedinrome.com/news/italy-pays-tribute-to-health-workers-as-nation-marks-covid-19-anniversary.html,,,,
Italy,21-Feb,The town of Codogno remembers being at the centre of Italy's epidemic,https://www.euronews.com/2021/02/20/the-town-of-codogno-remembers-being-at-the-centre-of-italy-s-epidemic,,,,
Germany,21-Feb,COVID: AstraZeneca vaccine remains unpopular in Germany,https://www.dw.com/en/covid-astrazeneca-vaccine-remains-unpopular-in-germany/a-56630827,,,,
Germany,21-Feb,"Germany, Once a Model, Is Swamped Like Everyone Else by Pandemic’s Second Wave",https://www.nytimes.com/2021/02/20/world/europe/germany-coronavirus-second-wave.html,,,,
Germany,21-Feb,Germany urges 'caution' as COVID infections climb again,https://medicalxpress.com/news/2021-02-germany-urges-caution-covid-infections.html,,,,
Germany,21-Feb,The medieval German town at the heart of the fight against Covid,https://www.ft.com/content/13d23af0-5f0c-4215-a017-39f6b145d0e8,,,,
Germany,21-Feb,Merkel Targets Cautious Reopening as Germany’s Outbreak Worsens,https://www.bloomberg.com/news/articles/2021-02-21/germany-damps-hopes-for-easing-curbs-as-contagion-rates-rise,,,,
Spain,21-Feb,"Latest Foreign Office rules for Spain, Greece, Portugal, USA, France, Italy, and Germany during lockdown",https://www.cambridge-news.co.uk/news/uk-world-news/coronavirus-travel-rules-uk-spain-19875292,,,,
Spain,21-Feb,Coronavirus: What Europeans have learned from a year of pandemic,https://www.bbc.com/news/world-europe-56110051,,,,
Spain,21-Feb,Spain: Additional protests over free speech likely across Spain through at least Feb. 22,https://www.garda.com/crisis24/news-alerts/445646/spain-additional-protests-over-free-speech-likely-across-spain-through-at-least-feb-22,,,,
Spain,21-Feb,Spain holidays: Mallorca & Menorca desperate to get Brits back - test Covid passports here,https://www.express.co.uk/news/world/1400640/coronavirus-latest-spain-holidays-mallorca-majorca-desperate-british-tourists,,,,
Spain,21-Feb,Spanish islands want to be first to welcome back Brits with 'vaccine passports',https://www.mirror.co.uk/news/uk-news/spanish-islands-want-first-welcome-23537397,,,,
France,21-Feb,France: Nice tells tourists to stay away as COVID cases soar,https://www.dw.com/en/france-nice-tells-tourists-to-stay-away-as-covid-cases-soar/a-56642120,,,,
France,21-Feb,Covid-19: Could empty office buildings help solve France's housing crisis?,https://www.france24.com/en/live-news/20210221-covid-19-could-empty-office-buildings-help-solve-france-s-housing-crisis,,,,
France,21-Feb,French health minister says new restrictions likely in certain regions,https://www.france24.com/en/france/20210220-french-health-minister-says-new-restrictions-likely-in-certain-regions,,,,
France,21-Feb,Macron to see in around 10 days if Covid rules can ease,https://www.connexionfrance.com/French-news/Macron-to-see-in-around-10-days-if-Covid-rules-can-ease,,,,
France,21-Feb,French city of Nice asks tourists to stay away amid COVID surge,https://www.reuters.com/article/us-health-coronavirus-france-idUSKBN2AL061,,,,
UK,21-Feb,Covid vaccine: All UK adults to be offered jab by 31 July - PM,https://www.bbc.com/news/uk-56141867,,,,
UK,21-Feb,UK Covid lockdown easing: A No 10 'priority' is to allow more social contact,https://www.bbc.com/news/uk-55931181,,,,
UK,21-Feb,UK records 215 deaths – as it happened,https://www.theguardian.com/world/live/2021/feb/21/coronavirus-live-news-australia-begins-vaccine-rollout-israel-says-pfizer-jab-96-effective,,,,
UK,21-Feb,UK government under growing pressure over Covid procurement,https://www.theguardian.com/politics/2021/feb/20/uk-government-under-growing-pressure-over-covid-procurement,,,,
UK,21-Feb,Coronavirus digest: UK accelerates vaccine drive,https://www.dw.com/en/coronavirus-digest-uk-accelerates-vaccine-drive/a-56639696,,,,
Netherlands,14-Feb,Netherlands: Working from home due to the coronavirus: the Dutch tax impact ,https://wts.com/global/publishing-article/20210212-global-mobility-netherlands~publishing-article?language=en,,,,
Netherlands,14-Feb,Covid-19 school closures are widening Europe’s class divisions,https://www.economist.com/europe/2021/02/13/covid-19-school-closures-are-widening-europes-class-divisions,,,,
Netherlands,14-Feb,Coronavirus breath testing stopped after several false negatives: RTL,https://www.dutchnews.nl/news/2021/02/coronavirus-breath-testing-stopped-after-several-false-negatives-rtl/,,,,
Netherlands,14-Feb,Dutch take to the ice as canals and lakes freeze over,https://www.bbc.com/news/world-europe-56054975,,,,
Netherlands,14-Feb,How coronavirus affects young and old,https://coronadashboard.government.nl/artikelen/hoe-het-coronavirus-jong-en-oud-raakt,,,,
Italy,14-Feb,Covid-19: Italy’s ski slopes to stay closed until 5 March,https://www.wantedinrome.com/news/covid-19-italys-ski-slopes-to-stay-closed-until-5-march.html,,,,
Italy,14-Feb,"Covid-19: Italy’s latest toll of 311 deaths brings total well over 93,000",https://www.irishtimes.com/news/world/covid-19-italy-s-latest-toll-of-311-deaths-brings-total-well-over-93-000-1.4484352,,,,
Italy,14-Feb,"Italy could have had COVID-19 patient zero in Nov 2019, study says",https://www.chinadaily.com.cn/a/202102/13/WS6027c9e2a31024ad0baa8e3f.html,,,,
Italy,14-Feb,Italy’s new government to deal with Covid and economic recession,https://www.rfi.fr/en/europe/20210213-italy-s-new-government-to-deal-with-covid-and-economic-recession-politics-europe-economy-mario-draghi,,,,
Italy,14-Feb,Italian regions seek separate vaccine deals,https://www.euractiv.com/section/politics/news/italian-regions-seek-separate-vaccine-deals/,,,,
Germany,14-Feb,Coronavirus: Germans' mental health worse in second lockdown — study,https://www.dw.com/en/coronavirus-germans-mental-health-worse-in-second-lockdown-study/a-56557809,,,,
Germany,14-Feb,Germany looks for ways out of the pandemic,https://www.dw.com/en/germany-looks-for-ways-out-of-the-pandemic/av-56518255,,,,
Germany,14-Feb,Germany tightens border controls in attempt to limit spread of COVID-19 variants,https://www.euronews.com/2021/02/14/germany-tightens-border-controls-in-attempt-to-limit-spread-of-covid-19-variants,,,,
Germany,14-Feb,Germany tightens borders to keep Covid-19 variants at bay,https://www.straitstimes.com/world/europe/germany-tightens-borders-to-keep-covid-19-variants-at-bay,,,,
Germany,14-Feb,"Portugal extends state of emergency, Germany's border call: COVID-19 daily bulletin",https://newseu.cgtn.com/news/2021-02-12/Portugal-extends-emergency-rules-Germany-border-call-COVID-bulletin-XPbWM8lJYI/index.html,,,,
Spain,14-Feb,Architecture of an outbreak: the Spanish apartment building hijacked by the coronavirus,https://english.elpais.com/society/2021-02-15/architecture-of-an-outbreak-the-spanish-apartment-building-hijacked-by-the-coronavirus.html,,,,
Spain,14-Feb,Antiviral breakthrough in Spain could help reduce COVID-19 mortality,https://newseu.cgtn.com/news/2021-02-13/Antiviral-breakthrough-in-Spain-could-help-reduce-COVID-19-mortality-XPgYQFS1AA/index.html,,,,
Spain,14-Feb,Catalonia election: Will the coronavirus pandemic help oust pro-independence parties?,https://www.euronews.com/2021/02/14/will-the-coronavirus-pandemic-help-oust-pro-independence-parties-in-catalonia,,,,
Spain,14-Feb,Spain’s Catalonia holds key election amid fears over COVID,https://www.aljazeera.com/news/2021/2/14/spains-catalonia-holds-key-election-amid-fears-over-covid,,,,
Spain,14-Feb,Spain tops one million fully vaccinated; retailers offer help to speed up campaign,https://www.reuters.com/article/us-health-coronavirus-spain-idUKKBN2AC278,,,,
France,14-Feb,"France reports 21,231 new coronavirus cases over 24 hours",https://www.reuters.com/article/us-health-coronavirus-france-idUSKBN2AD0M7,,,,
France,14-Feb,Coronavirus digest: France backs one jab for COVID survivors,https://www.dw.com/en/coronavirus-digest-france-backs-one-jab-for-covid-survivors/a-56556403,,,,
France,14-Feb,The Big Question: Can France Catch Up in the Covid Vaccine Race?,https://www.bloombergquint.com/gadfly/why-is-france-losing-the-covid-vaccine-race,,,,
France,14-Feb,"COVID-19: Previously-infected people only need one vaccine shot, say French experts",https://news.sky.com/story/covid-19-previously-infected-people-only-need-one-vaccine-shot-say-french-experts-12216693,,,,
France,14-Feb,New French nasal spray eliminates 99% of Covid virus,https://www.connexionfrance.com/French-news/New-French-nose-spray-eliminates-99-of-Covid-virus-via-nose-blowing,,,,
UK,14-Feb,"Covid-19: UK failed to heed the virus alerts, says vaccine creator",https://www.theguardian.com/world/2021/feb/13/covid-uk-failed-to-heed-the-virus-alerts-says-vaccine-creator,,,,
UK,14-Feb,Covid: experts warn of huge UK wave if restrictions lifted too soon,https://www.theguardian.com/world/2021/feb/13/experts-warn-huge-uk-covid-wave-if-restrictions-lifted-too-soon,,,,
UK,14-Feb,Covid: Vaccine given to 15 million in UK as PM hails 'extraordinary feat',https://www.bbc.com/news/uk-56062976,,,,
UK,14-Feb,Covid-19: Over-65s to receive jab in next phase of rollout in England,https://www.bbc.com/news/uk-56057402,,,,
UK,14-Feb,UK backs Biden’s call for China to release data on coronavirus origin,https://www.politico.eu/article/coronavirus-china-origin-data-uk-backs-joe-biden-call/,,,,
Netherlands,07-Feb,UPDATE 1-Netherlands coronavirus cases surpass a million -official data,https://www.reuters.com/article/health-coronavirus-netherlands-idUSL1N2KC0B4,,,,
Netherlands,07-Feb,One protester on why he took to the streets over Dutch COVID curfew,https://www.euronews.com/2021/02/06/one-protester-on-why-he-took-to-the-streets-over-dutch-covid-curfew,,,,
Netherlands,07-Feb,Netherlands surpasses 1 million Covid-19 cases,https://edition.cnn.com/world/live-news/coronavirus-pandemic-vaccine-updates-02-06-21/h_35975b8ab4c4b79a35b8bdbf97ce5b56,,,,
Netherlands,07-Feb,"Dutch cases top 1m, Greece's regional tightening: COVID-19 daily bulletin",https://newseu.cgtn.com/news/2021-02-06/Greece-tightens-Spain-limits-AstraZeneca-jab-COVID-19-daily-bulletin-XFdGDRf4WI/index.html,,,,
Netherlands,07-Feb,Netherlands issues 'code red' alert as heavy snow closes COVID testing centres,https://news.sky.com/story/netherlands-issues-code-red-alert-as-heavy-snow-closes-covid-testing-centres-12211701,,,,
