Country,Date,Headline,Link,,,,
Netherlands,26-May,Netherlands: COVID-19-related Mandatory Closures Of Rented Premises: The Consequences For Lessors And Lessees ,https://www.mondaq.com/operational-impacts-and-strategy/1071930/covid-19-related-mandatory-closures-of-rented-premises-the-consequences-for-lessors-and-lessees,,,,
Netherlands,26-May,Coronavirus in the Netherlands: all you need to know [UPDATED],https://dutchreview.com/news/coronavirus-netherlands/,,,,
Netherlands,26-May,Dutch Covid hospitalizations 53% below peak; ICU total near 10-week low,https://nltimes.nl/2021/05/25/dutch-covid-hospitalizations-53-peak-icu-total-near-10-week-low,,,,
Netherlands,26-May,Bad weather and Covid-19 delay Dutch lake project,https://www.newsbreak.com/news/2261534644967/bad-weather-and-covid-19-delay-dutch-lake-project,,,,
Netherlands,26-May,"Netherlands: Migrant workers face job loss, homelessness & lack protection as COVID-19 spreads",https://www.business-humanrights.org/en/latest-news/netherlands-migrant-workers-face-job-loss-homelessness-lack-protection-as-covid-19-spreads/,,,,
Italy,26-May,The millennials using Covid to change Sicily's €1 home schemes,https://edition.cnn.com/travel/article/cammarata-sicily-1-euro-homes-streetto/index.html,,,,
Italy,26-May,"Proximity and post-COVID-19 urban development: Reflections from Milan, Italy",https://www.sciencedirect.com/science/article/pii/S2226585621000339,,,,
Italy,26-May,How to enter Italy during COVID-19 Quarantine for Pakistan,https://www.ivisa.com/italy-blog/how-to-enter-italy-during-covid-19-quarantine-for-pakistan,,,,
Italy,26-May,"Italy reports 166 coronavirus deaths on Tuesday, 3,224 new cases",https://finance.yahoo.com/news/italy-reports-166-coronavirus-deaths-152353933.html,,,,
Italy,26-May,Holiday boost for Britons as 'vaccine rush' means Italy set to open for 'Covid-free' trips,https://www.express.co.uk/news/world/1441154/Summer-holiday-news-coronavirus-travel-latest-Italy-vaccine-update,,,,
Germany,26-May,"Frequently asked questions on Digital Registration on Entry, the obligation to furnish proof and quarantine on entry",https://www.bundesgesundheitsministerium.de/coronavirus-infos-reisende/faq-tests-einreisende-englisch.html,,,,
Germany,26-May,German economy hit harder than expected by COVID crisis,https://www.dw.com/en/german-economy-hit-harder-than-expected-by-covid-crisis/a-57650920,,,,`
Germany,26-May,Summer boom beckons for German economy after winter COVID blues,https://www.reuters.com/world/europe/german-business-morale-improves-more-than-expected-2-year-high-2021-05-25/,,,,
Germany,26-May,China replaces Germany as UK’s biggest import market,https://www.theguardian.com/business/2021/may/25/uk-trade-with-eu-falls-by-23-in-first-quarter-as-brexit-and-covid-hit,,,,
Germany,26-May,New four-week “lockdown light” takes effect in Germany,https://www.aipsmedia.com/?page=artdetail&art=28770&GermanyCoronavirusCoronavirus-updatesPost-COVID-journalism,,,,
Spain,26-May,"Two weeks after end of state of alarm in Spain, fall in coronavirus incidence continues but at a slightly slower pace",https://english.elpais.com/society/2021-05-25/two-weeks-after-end-of-state-of-alarm-in-spain-fall-in-coronavirus-incidence-continues-but-at-a-slightly-slower-pace.html,,,,
Spain,26-May,Covid-19: Travelling from Ireland to Spain,http://www.exteriores.gob.es/Embajadas/DUBLIN/en/Embajada/ServiciosConsulares/Pages/Covid-19-Travelling-to-Spain.aspx,,,,
Spain,26-May,Spain investigates new strain after ISL player tests positive for Covid-19,https://timesofindia.indiatimes.com/city/goa/spain-investigates-new-strain-after-isl-player-tests-positive-for-covid-19/articleshow/82953414.cms,,,,
Spain,26-May,COVID-19 pandemic delays completion of Spain’s Sagrada Familia beyond 2026,https://english.alarabiya.net/coronavirus/2021/05/25/COVID-19-pandemic-delays-completion-of-Spain-s-Sagrada-Familia-beyond-2026,,,,
Spain,26-May,"Cyprus Moves US, Romania & Thailand to Low-Risk Category – Removes Entry Restrictions for Malta Travellers",https://www.schengenvisainfo.com/news/cyprus-moves-us-romania-thailand-to-low-risk-category-removes-entry-restrictions-for-malta-travellers/,,,,
France,26-May,France to Ban British Travellers Due to COVID-19 New Variant,https://www.schengenvisainfo.com/news/france-to-ban-british-travellers-due-to-covid-19-new-variant/,,,,
France,26-May,"French COVID-19 cases, patient numbers and deaths fall further",https://www.reuters.com/world/europe/french-covid-19-cases-patient-numbers-deaths-fall-further-2021-05-25/,,,,
France,26-May,EU summit welcomes Covid certificate to unlock travel,https://www.france24.com/en/live-news/20210525-eu-summit-welcomes-covid-certificate-to-unlock-travel,,,,
France,26-May,Explained: Covid-19 rules for travel to and from France,https://www.connexionfrance.com/French-news/Rules-for-travel-to-and-from-France-explained-during-Covid-19,,,,
France,26-May,Coronavirus: what is the current situation in France?,https://www.completefrance.com/travel/coronavirus-2020-is-it-safe-to-travel-to-france-1-6555880,,,,
UK,26-May,Covid-19: First man to get jab William Shakespeare dies of unrelated illness,https://www.bbc.com/news/uk-england-coventry-warwickshire-57234741,,,,
UK,26-May,UK COVID-19 Update: Government Defends Indian Variant Travel Advice,https://www.medscape.com/viewarticle/951775,,,,
UK,26-May,UK government to clarify Covid advice for eight areas hit by variant ,https://www.ft.com/content/c36a9587-fa02-43c0-938f-37f8e70c83b7,,,,
UK,26-May,COVID-19: UK reports 15 more coronavirus deaths - as 23 million people are now fully vaccinated,https://news.sky.com/story/covid-19-uk-reports-15-more-coronavirus-deaths-as-23-million-people-are-now-fully-vaccinated-12316798,,,,
UK,26-May,UK wedding industry fears collapse if Covid rules not eased in June,https://www.theguardian.com/world/2021/may/25/uk-wedding-industry-fears-collapse-if-covid-rules-not-eased-in-june,,,,
Netherlands,21-May,"Netherlands (Travel Restrictions, COVID Tests & Quarantine Requirements)",https://blog.wego.com/netherlands-travel-restrictions-and-quarantine-requirements/,,,,
Netherlands,21-May,"Brussels, MEPs agree compromise deal on EU coronavirus travel permit",https://www.dutchnews.nl/news/2021/05/brussels-meps-agree-compromise-deal-on-eu-coronavirus-travel-permit/,,,,
Netherlands,21-May,"Ethnic minority Amsterdammers harder hit by coronavirus, according to report",https://www.dutchnews.nl/news/2021/05/ethnic-minority-amsterdammers-harder-hit-by-coronavirus-according-to-report/,,,,
Netherlands,21-May,"Dutch Covid hospital total plunges below 2,000; Lowest point in 10 weeks",https://nltimes.nl/2021/05/20/dutch-covid-hospital-total-plunges-2000-lowest-point-10-weeks,,,,
Netherlands,21-May,"Eurovision Rotterdam 2021 thrown into chaos after positive COVID-19 tests for Netherlands, Iceland",https://www.perthnow.com.au/news/world/eurovision-rotterdam-2021-thrown-into-chaos-after-positive-covid-19-tests-for-netherlands-iceland-ng-b881878225z,,,,
Italy,21-May,Covid-19: Italy reopens for international tourism,https://www.theflorentine.net/2021/05/20/covid-19-italy-reopens-for-international-tourism/,,,,
Italy,21-May,How Can the Citizens of Italy enter Malta During Coronavirus?,https://www.ivisa.com/malta-blog/how-can-the-citizens-of-italy-enter-malta-during-coronavirus,,,,
Italy,21-May,Rural Italy Had a Pandemic Renaissance. Can It Last?,https://www.bloomberg.com/news/articles/2021-05-21/how-covid-repopulated-rural-italian-villages,,,,
Italy,21-May,Italy to Loosen Coronavirus Restrictions in Some Areas,https://www.usnews.com/news/health-news/articles/2021-05-21/italy-to-loosen-coronavirus-restrictions-in-some-areas,,,,
Italy,21-May,"Italy ready to fund ReiThera COVID-19 vaccine project, minister says",https://www.reuters.com/business/healthcare-pharmaceuticals/italy-govt-ready-fund-reithera-covid-19-vaccine-project-minister-says-2021-05-21/,,,,
Germany,21-May,COVID vaccination: 'Should we draw lots?',https://www.dw.com/en/covid-vaccination-should-we-draw-lots/a-57592777,,,,
Germany,21-May,How can the citizens of Germany enter Malta During Coronavirus?,https://www.ivisa.com/malta-blog/how-can-the-citizens-of-germany-enter-malta-during-coronavirus,,,,
Germany,21-May,Germany Bans UK Travellers From Entering the Country Due to COVID-19 Variants,https://www.schengenvisainfo.com/news/germany-bans-uk-travellers-from-entering-the-country-due-to-covid-19-variants/,,,,
Germany,21-May,"Germany lifts more restrictions, Merkel urges caution",https://apnews.com/article/europe-berlin-lifestyle-travel-coronavirus-pandemic-bfb3bc41cedf2a7610f9ab4e462b6571,,,,
Germany,21-May,Germany to take France off coronavirus risk list -sources,https://www.reuters.com/world/europe/germany-take-france-off-coronavirus-risk-list-sources-2021-05-21/,,,,
Spain,21-May,Coronavirus: Spain to lift restrictions for UK and Japanese travellers,https://www.bbc.com/news/world-europe-57199791,,,,
Spain,21-May,Find Out How Citizens of Spain Can Enter Malta During Coronavirus,https://www.ivisa.com/malta-blog/find-out-how-citizens-of-spain-can-enter-malta-during-coronavirus,,,,
Spain,21-May,All vaccinated travelers will be allowed into Spain from June 7,https://www.aa.com.tr/en/europe/all-vaccinated-travelers-will-be-allowed-into-spain-from-june-7/2250065,,,,
Spain,21-May,Spain to drop Covid restrictions on British visitors from 24 May,https://www.theguardian.com/travel/2021/may/21/spain-to-drop-covid-restrictions-on-british-visitors-from-24-may,,,,
Spain,21-May,Pedro Sánchez: Fully vaccinated Brits don’t need a coronavirus test to visit Spain,https://www.politico.eu/article/uk-tourists-fully-vaccinated-allowed-to-travel-to-spain-without-tests-from-monday/,,,,
France,21-May,Covid France: When can we stop wearing face masks?,https://www.connexionfrance.com/French-news/Covid-France-When-can-we-stop-wearing-face-masks,,,,
France,21-May,EU Covid health pass approved for travel use from July 1,https://www.connexionfrance.com/French-news/EU-Covid-health-pass-approved-for-travel-use-from-July-1,,,,
France,21-May,"France extends Covid-19 vaccination to all adults from May 31, ahead of initial target",https://www.france24.com/en/europe/20210520-france-to-open-covid-19-vaccination-to-all-adults-ahead-of-june-15-target,,,,
France,21-May,"France opens coronavirus vaccination to all adults on May 31, two weeks sooner than planned",https://www.euronews.com/2021/05/20/france-opens-coronavirus-vaccination-to-all-adults-two-weeks-sooner-than-planned,,,,
France,21-May,Traveling to France during Covid-19: What you need to know before you go,https://kesq.com/entertainment/2021/05/31/traveling-to-france-during-covid-19-what-you-need-to-know-before-you-go/,,,,
UK,21-May,Prince William receives first Covid vaccine dose,https://www.bbc.com/news/uk-57185584,,,,
UK,21-May,"UK COVID-19 Update: 'Race' Between Virus and Vaccine, Third Wave Warning",https://www.medscape.com/viewarticle/951129,,,,
UK,21-May,"UK daily COVID cases highest in a month, Indian variant rising sharply",https://www.reuters.com/world/uk/uk-records-2874-covid-19-cases-highest-daily-total-month-2021-05-20/,,,,
UK,21-May,"UK Covid: India variant case numbers rise to 3,424 – up 160% over past week – as it happened",https://www.theguardian.com/politics/live/2021/may/20/uk-covid-news-priti-patel-amber-list-countries-quarantine-indian-variant-vaccine-coronavirus-latest-updates,,,,
UK,21-May,UK faces third wave of Covid-19 as Indian variant cases double,https://newsbook.com.mt/en/fear-that-the-indian-variant-is-leading-to-the-uk-third-coronavirus-wave/,,,,
Netherlands,14-May,Travel Firms Warn That Holidays in Netherlands Will Be More Expensive This Year,https://www.schengenvisainfo.com/news/travel-firms-warn-that-holidays-in-netherlands-will-be-more-expensive-this-year/,,,,
Netherlands,14-May,Netherlands reaches 7 million Covid vaccinations; New daily record set Wednesday,https://nltimes.nl/2021/05/13/netherlands-reaches-7-million-covid-vaccinations-new-daily-record-set-wednesday,,,,
Netherlands,14-May,Dutch Covid hospitalizations down 24% from peak; Lockdown easing more likely,https://nltimes.nl/2021/05/14/dutch-covid-hospitalizations-24-peak-lockdown-easing-likely,,,,
Netherlands,14-May,Dutch tulip farmers are hoping for a post-pandemic boom,https://www.nationalgeographic.com/travel/article/for-dutch-tulip-farms-a-season-of-rebirth,,,,
Netherlands,14-May,Noisy neighbours during coronavirus plague the Netherlands,https://www.dutchnews.nl/news/2021/05/noisy-neighbours-during-coronavirus-plague-the-netherlands/,,,,
Italy,14-May,"Italy to Abolish Quarantine Requirements for Travellers From EU, UK & Israel From May 16",https://www.schengenvisainfo.com/news/italy-to-abolish-quarantine-requirements-for-travellers-from-eu-uk-israel-from-may-16/,,,,
Italy,14-May,Italy Eases Covid Rules for EU Arrivals as Tourism Season Nears,https://www.bloomberg.com/news/articles/2021-05-14/italy-eases-covid-rules-for-eu-arrivals-as-tourism-season-nears,,,,
Italy,14-May,"Italy lifts quarantine for tourists from EU, UK and Israel from 16 May",https://www.wantedinrome.com/news/italy-lifts-quarantine-for-tourists-from-eu-uk-and-israel-from-16-may.html,,,,
Italy,14-May,"Italy lifts COVID quarantine for EU, UK and Israel from Sunday",https://www.reuters.com/article/us-health-coronavirus-italy-tourism-idUSKBN2CV118,,,,
Italy,14-May,EXCLUSIVE Italy audit court rejects public funding for ReiThera COVID-19 vaccine-sources,https://www.reuters.com/business/healthcare-pharmaceuticals/exclusive-italy-audit-court-rejects-public-funding-reithera-covid-19-vaccine-2021-05-14/,,,,
Germany,14-May,German police warn of fake COVID vaccine passport problem,https://www.dw.com/en/german-police-warn-of-fake-covid-vaccine-passport-problem/a-57517240,,,,
Germany,14-May,"Coronavirus digest: German infection rate at 2-month low, vaccinations speed up",https://www.dw.com/en/coronavirus-digest-german-infection-rate-at-2-month-low-vaccinations-speed-up/a-57524226,,,,
Germany,14-May,Germany COVID Infection Rate Falls Below Key Threshold ,https://www.voanews.com/europe/germany-covid-infection-rate-falls-below-key-threshold,,,,
Germany,14-May,Germany's COVID-19 case rate falls below key threshold,https://www.reuters.com/business/healthcare-pharmaceuticals/germanys-covid-19-case-rate-falls-below-key-threshold-2021-05-14/,,,,
Germany,14-May,German Curbs Set to Ease as Covid Cases Drop Below Key Level,https://www.bloomberg.com/news/articles/2021-05-14/german-curbs-set-to-ease-after-covid-cases-fall-below-key-level,,,,
Spain,14-May,Spain aims to boost COVID-stricken tourism sector with new campaign,https://www.euractiv.com/section/economy-jobs/news/spain-aims-to-boost-covid-stricken-tourism-sector-with-new-campaign/,,,,
Spain,14-May,Weekly Covid-19 deaths in Spain fall 90% since start of vaccination campaign,https://english.elpais.com/society/2021-05-13/weekly-covid-19-deaths-in-spain-fall-90-since-start-of-vaccination-campaign.html,,,,
Spain,14-May,Spain’s regions start to announce plans for vaccinating the under-50s,https://english.elpais.com/society/2021-05-14/spains-regions-start-to-announce-plans-for-vaccinating-the-under-50s.html,,,,
Spain,14-May,Tourism minister says Spain will be ready for COVID travel certificate in June,https://www.reuters.com/world/europe/tourism-minister-says-spain-will-be-ready-covid-travel-certificate-june-2021-05-13/,,,,
Spain,14-May,"Spain is on track for herd immunity, PM says",https://www.reuters.com/business/healthcare-pharmaceuticals/spain-is-track-herd-immunity-pm-says-2021-05-13/,,,,
France,14-May,Number of COVID-19 patients in intensive care falls in France,https://www.reuters.com/world/europe/number-covid-19-patients-intensive-care-falls-france-2021-05-14/,,,,
France,14-May,Student blues: How Covid-19 is affecting education in France,https://www.france24.com/en/tv-shows/french-connections/20210513-student-blues-how-covid-19-is-affecting-education-in-france,,,,
France,14-May,New French mental health campaign for young as Covid takes its toll,New French mental health campaign for young as Covid takes its toll,,,,
France,14-May,Do I need a Covid PCR test to fly between regions in France?,https://www.connexionfrance.com/Practical/Your-Questions/Do-I-need-a-Covid-PCR-test-to-fly-between-regions-in-France,,,,
France,14-May,France set to reach mid-May target of 20 million Covid vaccinations,https://www.rfi.fr/en/france/20210514-france-set-to-reach-mid-may-target-of-20-million-vaccinated-against-covid-19,,,,
UK,14-May,"Covid-19: Five ways to make hugging safer, from the experts",https://www.bbc.com/news/uk-57083571,,,,
UK,14-May,Indian variant: Second jabs could be brought forward to tackle rise,https://www.bbc.com/news/uk-57109660,,,,
UK,14-May,Coronavirus (COVID-19): requirements to provide public health information to passengers travelling to England,https://www.gov.uk/government/publications/coronavirus-covid-19-requirements-to-provide-public-health-information-to-passengers-travelling-to-england/coronavirus-covid-19-required-information-and-exemption-periods-under-the-public-health-information-for-passengers-travelling-to-england-regulati,,,,
UK,14-May,UK reports biggest daily rise in COVID cases since April 27,https://www.reuters.com/world/uk/uk-reports-biggest-daily-rise-covid-cases-since-april-27-2021-05-13/,,,,
UK,14-May,India variant could lead to serious third wave of Covid in UK,https://www.theguardian.com/world/2021/may/14/india-covid-variant-could-lead-to-third-wave-uk,,,,
Netherlands,07-May,Corona in Europe – How the Netherlands failed to get Covid under control,https://innovationorigins.com/en/corona-in-europe-how-the-netherlands-failed-to-get-covid-under-control/,,,,
Netherlands,07-May,Scientists in the Netherlands are training bees to detect COVID-19,https://6abc.com/bees-covid-19-detecting-coronavirus-wageningen-university-netherlands/10590302/,,,,
Netherlands,07-May,Eurovision's noisy fans are back despite Dutch pandemic,https://www.bbc.com/news/world-europe-57008359,,,,
Netherlands,07-May,How many people have actually died from coronavirus in the Netherlands?,https://www.dutchnews.nl/news/2021/05/how-many-people-have-actually-died-from-coronavirus-in-the-netherlands/,,,,
Netherlands,07-May,Netherlands in 9th for EU Covid vaccines; 6.1 million shots estimated,https://nltimes.nl/2021/05/07/netherlands-9th-eu-covid-vaccines-61-million-shots-estimated,,,,
Italy,07-May,"Travel to Italy: Covid pass valid for US and UK visitors, says tourism minister",https://www.wantedinrome.com/news/travel-to-italy-covid-pass-valid-for-us-and-uk-visitors-says-tourism-minister.html,,,,
Italy,07-May,Italy: Covid-19 Emergency Update: New Protocols on safety measures in the workplace and the implementation of a vaccination program in the workplace have been signed,https://globalcompliancenews.com/italy-covid-19-emergency-update-a-new-protcol-on-safety-measures-at-the-workplace-and-a-new-protcol-for-the-implementation-of-vaccination-campaign-at-the-workpace-have-been-signed-09042021/,,,,
Italy,07-May,Italy will reopen to tourists from mid-May with country’s ‘green pass’,https://www.irishtimes.com/life-and-style/travel/europe/italy-will-reopen-to-tourists-from-mid-may-with-country-s-green-pass-1.4557121,,,,
Italy,07-May,Italy: Vaccination on the vacation islands,https://www.dw.com/en/italy-vaccination-on-the-vacation-islands/av-57419867,,,,
Italy,07-May,"Italy: Authorities extend the suspension of travel from India, Bangladesh, and Sri Lanka until May 30 due to concerns over the COVID-19 variant /update 47",https://www.garda.com/crisis24/news-alerts/476026/italy-authorities-extend-the-suspension-of-travel-from-india-bangladesh-and-sri-lanka-until-may-30-due-to-concerns-over-the-covid-19-variant-update-47,,,,
Germany,07-May,Covid: Germany rejects US-backed proposal to waive vaccine patents,https://www.bbc.com/news/world-europe-57013096,,,,
Germany,07-May,German parliament approves bill on freedoms for COVID vaccinated people,https://www.dw.com/en/german-parliament-approves-bill-on-freedoms-for-covid-vaccinated-people/a-57450855,,,,
Germany,07-May,Germany to loosen COVID restrictions for vaccinated people,https://www.dw.com/en/germany-to-loosen-covid-restrictions-for-vaccinated-people/av-57454746,,,,
Germany,07-May,Coronavirus: Germany opens up AstraZeneca COVID vaccines for all adults,https://www.dw.com/en/coronavirus-germany-opens-up-astrazeneca-covid-vaccines-for-all-adults/a-57453351,,,,
Germany,07-May,US-Germany rift as Berlin opposes plan to ditch Covid vaccine patents,https://www.theguardian.com/world/2021/may/06/us-germany-rift-covid-vaccine-patent-waivers,,,,
Spain,07-May,"The silent epidemic of lymphogranuloma venereum inside the COVID-19 pandemic in Madrid, Spain, March 2020 to February 2021",https://www.eurosurveillance.org/content/10.2807/1560-7917.ES.2021.26.18.2100422,,,,
Spain,07-May,"Spain backs vaccine patent waiver, calls for more international cooperation",https://www.reuters.com/world/europe/spain-says-vaccine-patent-waiver-is-way-forward-not-enough-poor-countries-2021-05-06/,,,,
Spain,07-May,What will happen when Spain’s state of alarm expires? Supreme Court set to take key role with express rulings,https://english.elpais.com/society/2021-05-06/what-will-happen-when-spains-state-of-alarm-expires-supreme-court-set-to-take-key-role-with-express-rulings.html,,,,
Spain,07-May,"Coronavirus cases falling in Spain, but hospitals remain under pressure",https://english.elpais.com/society/2021-05-07/coronavirus-cases-falling-in-spain-but-hospitals-remain-under-pressure.html,,,,
Spain,07-May,Spain finds 11 cases of COVID-19 variant first identified in India,https://www.newindianexpress.com/world/2021/may/06/spain-finds-11-cases-of-covid-19-variant-first-identified-in-india-2299231.html,,,,
France,07-May,Covid-19: France orders 10-day quarantine for arrivals from seven more countries,https://www.france24.com/en/europe/20210507-covid-19-france-mandates-10-day-quarantine-for-arrivals-from-seven-more-countries,,,,
France,07-May,France delaying EU order for COVID-19 vaccine -Germany's Welt,https://www.reuters.com/world/europe/france-delaying-eu-order-covid-19-vaccine-germanys-welt-2021-05-07/,,,,
France,07-May,Covid France: ‘Spare dose’ vaccine slots open to all from May 12,https://www.connexionfrance.com/French-news/Covid-France-Spare-dose-vaccine-slots-open-to-all-from-May-12,,,,
France,07-May,French president backs lifting of patents on COVID-19 vaccines,https://www.aa.com.tr/en/europe/french-president-backs-lifting-of-patents-on-covid-19-vaccines/2231980,,,,
France,07-May,Covid pandemic leaves Air France-KLM with huge financial hole,https://www.rfi.fr/en/france/20210506-covid-pandemic-leaves-air-france-klm-floundering-with-huge-financial-hole,,,,
UK,07-May,Covid-19: Complaints after England booking site reveals vaccine status,https://www.bbc.com/news/uk-57010120,,,,
UK,07-May,Covid: How does the Oxford-AstraZeneca vaccine work?,https://www.bbc.com/news/health-55302595,,,,
UK,07-May,UK COVID-19 Update: Strong Protection from Pfizer Jab and Vaccine Confidence Remains High,https://www.medscape.com/viewarticle/950654,,,,
UK,07-May,"UK working with U.S., WTO on boosting COVID vaccine supply",https://www.reuters.com/business/healthcare-pharmaceuticals/uk-working-with-us-wto-boosting-covid-vaccine-supply-spokesman-2021-05-06/,,,,
UK,07-May,"COVID-19: UK reports 13 more coronavirus deaths and 2,613 new cases - as 16m now fully vaccinated",https://news.sky.com/story/covid-19-uk-reports-13-more-coronavirus-deaths-and-2-613-new-cases-as-16m-now-fully-vaccinated-12298501,,,,
Netherlands,01-May,Netherlands: Authorities maintaining COVID-19 restrictions as of April 30 /update 35,https://www.garda.com/crisis24/news-alerts/473541/netherlands-authorities-maintaining-covid-19-restrictions-as-of-april-30-update-35,,,,
Netherlands,01-May,Netherlands won't ease lockdown further until at least mid May,https://www.reuters.com/world/europe/netherlands-wont-ease-lockdown-further-until-least-mid-may-2021-05-01/,,,,
Netherlands,01-May,European Parliament green lights EU coronavirus passport,https://www.iamexpat.nl/expat-info/dutch-expat-news/european-parliament-green-lights-eu-coronavirus-passport,,,,
Netherlands,01-May,How keeping health a priority is a prescription for European prosperity,https://www.mckinsey.com/nl/our-insights,,,,
Netherlands,01-May,Netherlands disables COVID-tracing app after discovering it helps Google collect private data,https://eturbonews.com/2994368/netherlands-disables-covid-tracing-app-after-discovering-it-helps-google-collect-private-data/,,,,
Italy,01-May,Things to Remember on How to Enter Italy during Coronavirus,https://www.ivisa.com/italy-blog/things-to-remember-on-how-to-enter-italy-during-coronavirus,,,,
Italy,01-May,Italy Prolongs Quarantine for EU Travellers Until May 15,https://www.schengenvisainfo.com/news/italy-prolongs-quarantine-for-eu-travellers-until-may-15/,,,,
Italy,01-May,Italy hits daily vaccination target despite slow deliveries,https://www.reuters.com/world/europe/italy-hits-daily-vaccination-target-despite-slow-deliveries-2021-04-30/,,,,
Italy,01-May,"Italy reports 226 coronavirus deaths on Saturday, 12,965 new cases",https://www.reuters.com/world/europe/italy-reports-226-coronavirus-deaths-saturday-12965-new-cases-2021-05-01/,,,,
Italy,01-May,Italy's COVID Rt rises back up to 0.85,https://www.ansa.it/english/news/general_news/2021/04/30/italys-covid-rt-rises-back-up-to-0.85_51aedd0a-a4c4-4315-8c22-1a2bf852ba5d.html,,,,
Germany,01-May,Germans in the time of coronavirus ,https://www.politico.eu/article/germans-in-the-time-of-covid-19/,,,,
Germany,01-May,German economy shrinks 1.7% amid COVID crisis,https://www.dw.com/en/german-economy-shrinks-17-amid-covid-crisis/a-57385671,,,,
Germany,01-May,Germany sets new European record with 1m Covid vaccinations in a day,https://www.standard.co.uk/news/uk/germany-europe-covid-vaccine-record-b932580.html,,,,
