Country,Date,Headline,Link,,,,
Italy,07-Feb,Italy’s Visco Sees Recovery Even as Covid Weighs on Growth,https://www.bloomberg.com/news/articles/2021-02-06/italy-s-visco-sees-recovery-even-as-covid-weighs-on-growth,,,,
Italy,07-Feb,Italy clears emergency use of COVID-19 antibody therapies,https://english.alarabiya.net/coronavirus/2021/02/06/Coronavirus-Italy-clears-emergency-use-of-COVID-19-antibody-therapies,,,,
Italy,07-Feb,Italy clears emergency use of COVID-19 antibody therapies ,https://www.reuters.com/article/health-coronavirus-italy-idUSS8N2AH04Y,,,,
Italy,07-Feb,The europe second wave of COVID-19 infection and the Italy “strange” situation,https://www.sciencedirect.com/science/article/pii/S0013935120313736,,,,
Italy,07-Feb,Italy: COVID-19 – Online sale of masks – sanctions by the Italian Antitrust Authority for unfair commercial practices,https://globalcompliancenews.com/italy-covid-19-online-sale-of-masks-sanctions-by-the-italian-antitrust-authority-for-unfair-commercial-practices150121/,,,,
Germany,07-Feb,"Germany: Politicians, virologists facing 'rising hostility from COVID deniers'",https://www.dw.com/en/germany-politicians-virologists-facing-rising-hostility-from-covid-deniers/a-56481455,,,,
Germany,07-Feb,Coronavirus death rate soars in Germany’s Saxony,https://www.dw.com/en/coronavirus-death-rate-soars-in-germanys-saxony/av-56314112,,,,
Germany,07-Feb,Covid: Vaccine tensions stoke German criticism of EU's von der Leyen,https://www.bbc.com/news/world-europe-55948360,,,,
Germany,07-Feb,"Germany’s confirmed coronavirus cases rise by 8,616",https://www.arabnews.com/node/1805146/world,,,,
Germany,07-Feb,Chinese demand helps German manufacturers weather COVID-19 pandemic,https://www.reuters.com/article/us-germany-economy-industrialoutput-idUSKBN2A80MC,,,,
Spain,07-Feb,Spain: COVID-19 patients tie the knot at Madrid pandemic hospital ,https://www.euronews.com/2021/02/06/spain-covid-19-patients-tie-the-knot-at-madrid-pandemic-hospital,,,,
Spain,07-Feb,Spanish scientists test drug for COVID-19 treatment,https://www.dw.com/en/spanish-scientists-test-drug-for-covid-19-treatment/av-56483034,,,,
Spain,07-Feb,New coronavirus variants cause concern in Spain,https://www.aa.com.tr/en/europe/new-coronavirus-variants-cause-concern-in-spain/2135631,,,,
Spain,07-Feb,Spain approaches end of phase 1 of Covid vaccination campaign,https://english.elpais.com/society/2021-02-08/spain-approaches-end-of-phase-1-of-covid-vaccination-campaign.html,,,,
Spain,07-Feb,Spain: Protesters stage ‘meditation’ protest against COVID restrix in Barcelona,https://www.ruptly.tv/en/videos/20210206-023-Spain--Protesters-stage--meditation--protest-against-COVID-restrix-in-Barcelona,,,,
France,07-Feb,France starts AstraZeneca inoculations amid decline in Covid-19 cases,https://www.france24.com/en/france/20210206-france-starts-astrazeneca-inoculations-as-covid-19-cases-ease,,,,
France,07-Feb,Research finds Covid in France before Wuhan market outbreak,https://www.connexionfrance.com/French-news/Research-finds-Covid-19-circulating-in-France-before-Wuhan-market-outbreak,,,,
France,07-Feb,€300m for Covid vaccines and medicines to be made in France,https://www.connexionfrance.com/French-news/France-pledges-300m-for-Covid-vaccine-and-health-projects-amid-Valneva-trials,,,,
France,07-Feb,"French COVID-19 cases, patient numbers ease as AstraZeneca inoculations start",https://www.reuters.com/article/us-health-coronavirus-france-casualties-idUSKBN2A60QL,,,,
France,07-Feb,France reports fresh fall in number of new COVID-19 cases,https://www.reuters.com/article/us-health-coronavirus-france-casualties-idUSKBN2A70Q4,,,,
UK,07-Feb,Covid: More than 12 million in UK have had first jab,https://www.bbc.com/news/uk-55973847,,,,
UK,07-Feb,Covid: Oxford jab offers less S Africa variant protection,https://www.bbc.com/news/uk-55967767,,,,
UK,07-Feb,'Another wave is possible': Paris braces for UK Covid variant,https://www.theguardian.com/world/2021/feb/07/another-wave-is-possible-paris-braces-for-uk-covid-variant,,,,
UK,07-Feb,Fall in Covid cases slower in UK's poor regions,https://www.theguardian.com/world/2021/feb/06/fall-in-covid-cases-slower-in-poor-regions,,,,
UK,07-Feb,"COVID-19: UK infections, deaths continue decline",https://www.aa.com.tr/en/europe/covid-19-uk-infections-deaths-continue-decline/2136356,,,,
Netherlands,01-Feb,Study reveals the Netherlands’ relatively poor handling of coronavirus crisis,https://www.iamexpat.nl/expat-info/dutch-expat-news/study-reveals-netherlands-relatively-poor-handling-coronavirus-crisis,,,,
Netherlands,01-Feb,More contagious mutation causes half of new Dutch virus cases,https://www.reuters.com/article/us-health-coronavirus-netherlands-mutati-idUSKBN2A12QD,,,,
Netherlands,01-Feb,Netherlands to partially open schools in February,https://www.aa.com.tr/en/europe/netherlands-to-partially-open-schools-in-february/2129303,,,,
Netherlands,01-Feb,U.K. variant accounts for half of all new COVID-19 cases in the Netherlands,https://www.ctvnews.ca/health/coronavirus/u-k-variant-accounts-for-half-of-all-new-covid-19-cases-in-the-netherlands-1.5290792,,,,
Netherlands,01-Feb,Netherlands could end controversial curfew on 10 February ,https://www.brusselstimes.com/news/world-all-news/152178/netherlands-could-end-controversial-curfew-on-10-february-rutte-de-jonge-coronavirus-exit-strategy/,,,,
Italy,01-Feb,Covid-19 in Italy: what you can and can't do in a yellow zone,https://www.wantedinrome.com/news/covid-19-in-italy-what-you-can-and-cant-do-in-a-yellow-zone.html,,,,
Italy,01-Feb,"Italy: Italy Quarantine Waived For Arrivals On Certain ""COVID-Free"" Flights ",https://www.mondaq.com/italy/government-measures/1031238/italy-quarantine-waived-for-arrivals-on-certain-covid-free-flights,,,,
Italy,01-Feb,Deaths among Rome's rough sleepers surge as shelters turn many away due to Covid,https://www.theguardian.com/world/2021/feb/01/rome-covid-rough-sleeper-deaths-italy,,,,
Italy,01-Feb,Lessons learned from COVID-19 pandemic in Italy - A commentary ,https://pubmed.ncbi.nlm.nih.gov/32415815/,,,,
Italy,01-Feb,Coronavirus disease 2019: the second wave in Italy,https://www.emerald.com/insight/content/doi/10.1108/JHR-10-2020-0514/full/html,,,,
Germany,01-Feb,Germany Bans Arrivals From Ireland & Portugal Over New COVID-19 Variants,https://www.schengenvisainfo.com/news/germany-bans-arrivals-from-ireland-portugal-over-new-covid-19-variants/,,,,
Germany,01-Feb,Germany considering Russian and Chinese vaccines to boost Covid inoculation drive,https://www.theguardian.com/world/2021/feb/01/germany-considering-russian-and-chinese-vaccines-to-boost-covid-inoculation-drive,,,,
Germany,01-Feb,France and Germany threaten AstraZeneca over vaccine shortage,https://www.theguardian.com/society/2021/jan/31/france-germany-threaten-covid-astrazeneca-vaccine-shortageeu-uk,,,,
Germany,01-Feb,COVID: Germany sends medical team and gear to Portugal,https://www.dw.com/en/covid-germany-sends-medical-team-and-gear-to-portugal/a-56397959,,,,
Germany,01-Feb,Coronavirus: Germany open to Chinese and Russian vaccines amid delays,https://www.dw.com/en/coronavirus-germany-open-to-chinese-and-russian-vaccines-amid-delays/a-56396510,,,,
Spain,01-Feb,The recovery forecast for Spain's construction sector after COVID-19,https://www.lexology.com/library/detail.aspx?g=d3388b68-33fb-4610-a419-d36374f9970c,,,,
Spain,01-Feb,"'We've had enough': In France, Spain and Denmark, anti-lockdown protests continue",https://www.euronews.com/2021/01/31/we-ve-had-enough-in-france-spain-and-denmark-anti-lockdown-protests-continue,,,,
Spain,01-Feb,Spanish study describes ‘Covid tongue’ as coronavirus symptom,https://english.elpais.com/science_tech/2021-02-01/spanish-study-describes-covid-tongue-as-coronavirus-symptom.html,,,,
Spain,01-Feb,Spain: Virus cases decline as makeshift hospitals open,https://www.aa.com.tr/en/europe/spain-virus-cases-decline-as-makeshift-hospitals-open/2130526,,,,
Spain,01-Feb,Spain Brings Back Land Border Controls With Portugal Due to COVID-19,https://www.schengenvisainfo.com/news/spain-brings-back-land-border-controls-with-portugal-due-to-covid-19/,,,,
France,01-Feb,"New Covid-19 restrictions ‘only delaying the inevitable,’ say French health experts",https://www.france24.com/en/europe/20210131-new-covid-19-restrictions-only-delaying-the-inevitable-say-french-epidemiologists,,,,
France,01-Feb,Covid-19: France closes borders to most non-EU travel,https://www.bbc.com/news/world-europe-55863069,,,,
France,01-Feb,Covid France rules: Large non-food commercial centres close,https://www.connexionfrance.com/French-news/Covid-France-rules-Large-non-food-commercial-centres-close,,,,
France,01-Feb,Think tank criticises France over Covid-19 management,https://www.connexionfrance.com/French-news/Think-tank-criticises-France-over-Covid-19-management-in-new-world-ranking,,,,
France,01-Feb,Think tank criticises France over Covid-19 management,https://www.connexionfrance.com/French-news/Think-tank-criticises-France-over-Covid-19-management-in-new-world-ranking,,,,
UK,01-Feb,UK's first Covid evacuees: 'I wish I'd stayed in Wuhan and missed flight',https://www.bbc.com/news/uk-england-manchester-55830497,,,,
UK,01-Feb,"Covid: EU 'made a mistake' over vaccines, Gove says",https://www.bbc.com/news/uk-55873288,,,,
UK,01-Feb,"January's daily UK Covid death toll averages more than 1,000, figures show",https://www.theguardian.com/world/2021/jan/30/januarys-daily-uk-covid-death-toll-averages-more-than-1000-figures-show,,,,
UK,01-Feb,"Daily record as 600,000 people in the UK receive Covid jabs on Saturday",https://www.theguardian.com/society/2021/jan/31/daily-record-as-600000-people-in-the-uk-receive-covid-jabs-on-saturday,,,,
UK,01-Feb,"COVID-19: UK reports another 587 coronavirus deaths - as vaccine doses rise by more than 600,000 for first time",https://news.sky.com/story/covid-19-uk-reports-another-587-coronavirus-deaths-as-vaccine-doses-rise-by-more-than-600-000-for-first-time-12204357,,,,
Netherlands,28-Jan,Angry citizens who hate the system': Why the riots in the Netherlands go beyond a COVID curfew,https://www.euronews.com/2021/01/27/angry-citizens-who-hate-the-system-why-the-riots-in-the-netherlands-go-beyond-a-covid-curf,,,,
Netherlands,28-Jan,Latest Travel Alerts and Warnings for the Netherlands,https://www.worldnomads.com/travel-safety/europe/netherlands/latest-travel-alerts,,,,
Netherlands,28-Jan,COVID-19 Update: Netherlands Entrance Requirements,https://www.imca-int.com/covid-19-update-netherlands-entrance-requirements/,,,,
Netherlands,28-Jan,Netherlands: New Curfew In The Netherlands Has Exceptions For Night Workers ,https://www.mondaq.com/employment-and-workforce-wellbeing/1029968/new-curfew-in-the-netherlands-has-exceptions-for-night-workers,,,,
Netherlands,28-Jan,Netherlands: What’s behind violent anti-lockdown riots?,https://www.aljazeera.com/news/2021/1/27/what-is-driving-the-netherlands-most-violent-riots-in-decades,,,,
Italy,28-Jan,Democratic responsibility in Italy under COVID-19,https://www.apa.org/international/global-insights/democratic-italy-covid-19,,,,
Italy,28-Jan,Cognitive and mental health changes and their vulnerability factors related to COVID-19 lockdown in Italy,https://journals.plos.org/plosone/article?id=10.1371/journal.pone.0246204,,,,
Italy,28-Jan,Italy Quarantine Waived For Arrivals on Certain “COVID-Free” Flights ,https://www.mondaq.com/italy/government-measures/1031238/italy-quarantine-waived-for-arrivals-on-certain-covid-free-flights,,,,
Italy,28-Jan,Patterns of Presentation of SARS-CoV-2 Infection in Children. Experience at the Italian Epicentre of the Pandemic,https://www.frontiersin.org/articles/10.3389/fped.2021.629040/full,,,,
Italy,28-Jan,Pfizer to continue vaccine supply to Italy even if Rome files lawsuit: CEO to paper,https://www.reuters.com/article/us-health-coronavirus-italy-pfizer-idUSKBN29X0PZ,,,,
Germany,28-Jan,Coronavirus: Germany loses sight of its refugees,https://www.dw.com/en/coronavirus-germany-loses-sight-of-its-refugees/a-56337347,,,,
Germany,28-Jan,"How COVID changed Germany, one year on",https://www.dw.com/en/how-covid-changed-germany-one-year-on/a-56350430,,,,
Germany,28-Jan,Germany expected to tighten borders to control spread of Covid variants,https://www.theguardian.com/world/2021/jan/27/germany-expected-to-tighten-borders-to-control-spread-of-covid-variants,,,,
Germany,28-Jan,Coronavirus: Germany set to limit AstraZeneca jab to under-65s,https://www.bbc.com/news/world-europe-55839885,,,,
Germany,28-Jan,"German economy to grow by 3 percent despite coronavirus, Berlin reckons",https://www.politico.eu/article/germany-economy-growth-coronavirus-peter-altmaier/,,,,
Spain,28-Jan,"The impact of Covid-19 on Spain’s demographics: new highs for deaths, lows for marriage",https://english.elpais.com/spanish_news/2021-01-27/the-impact-of-covid-19-on-spains-demographics-new-highs-for-deaths-lows-for-marriage.html,,,,
Spain,28-Jan,"Spain reports 36,435 new coronavirus cases and 591 deaths, the highest fatality figure of the third wave",https://english.elpais.com/society/2021-01-27/spain-reports-36435-new-coronavirus-cases-and-591-deaths-the-highest-fatality-figure-of-the-third-wave.html,,,,
Spain,28-Jan,Spanish anti-COVID drug 99% effective,https://www.euractiv.com/section/politics/short_news/spanish-anti-covid-drug-99-effective/,,,,
Spain,28-Jan,Madrid halting COVID-19 vaccinations due to supply delays,https://www.reuters.com/article/us-health-coronavirus-spain-vaccines-idUSKBN29W1GH,,,,
Spain,28-Jan,Spain detects first case of South Africa virus variant,https://www.aa.com.tr/en/europe/spain-detects-first-case-of-south-africa-virus-variant/2126613,,,,
France,28-Jan,Third lockdown in France may be imminent as Covid-19 cases surge,https://www.france24.com/en/france/20210127-fears-a-third-lockdown-may-be-imminent-as-france-s-covid-19-cases-surge,,,,
France,28-Jan,'Very tight' lockdown is one option under review in France,https://www.connexionfrance.com/French-news/Very-tight-lockdown-is-one-option-under-review-in-France,,,,
France,28-Jan,How to get Covid vaccine in France if no carte Vitale,https://www.connexionfrance.com/French-news/How-to-get-Covid-vaccine-in-France-if-no-carte-Vitale,,,,
France,28-Jan,COVID vaccine: France returns to 3 weeks between doses,https://www.euronews.com/2021/01/26/covid-vaccine-france-returns-to-3-weeks-between-doses,,,,
France,28-Jan,"France's curfew not slowing COVID-19 infections enough, says govt spokesman",https://www.reuters.com/article/us-health-coronavirus-france-idUSKBN29W1PG,,,,
UK,28-Jan,Coronavirus: EU demands UK-made AstraZeneca vaccine doses,https://www.bbc.com/news/world-europe-55822602,,,,
UK,28-Jan,Covid symptoms: What are they and how do I protect myself?,https://www.bbc.com/news/health-51048366,,,,
UK,28-Jan,Cough and sore throat more common with UK Covid variant – study,https://www.theguardian.com/world/2021/jan/27/cough-sore-throat-and-fatigue-common-symptoms-of-uk-covid-variant-finds-study,,,,
UK,28-Jan,Britain and EU clash over claims to UK-produced Covid vaccine,https://www.theguardian.com/world/2021/jan/27/eu-covid-vaccine-row-astrazeneca-european-commission,,,,
UK,28-Jan,COVID-19: Talk of a UK baby boom turns into fears of a baby bust - here's what the data reveals,https://news.sky.com/story/covid-19-talk-of-a-uk-baby-boom-turns-into-fears-of-a-baby-bust-heres-what-the-data-reveals-12199154,,,,
Netherlands,21-Jan,Lockdown measures tightened in response to concerns about new variants of virus,https://www.government.nl/latest/news/2021/01/20/lockdown-measures-tightened-in-response-to-concerns-about-new-variants-of-virus,,,,
Netherlands,21-Jan,Where can I get a NAAT(PCR) or rapid test outside the Netherlands?,https://www.netherlandsworldwide.nl/documents/frequently-asked-questions/where-can-i-get-a-pcr-or-rapid-test-outside-the-netherlands,,,,
Netherlands,21-Jan,Coronavirus digest: Netherlands introduces curfew to halt spread of new variant,https://www.dw.com/en/coronavirus-digest-netherlands-introduces-curfew-to-halt-spread-of-new-variant/a-56297819,,,,
Netherlands,21-Jan,Netherlands: Authorities announce tightening of international entry and domestic restrictions Jan. 20 due to COVID-19 /update 23,https://crisis24.garda.com/insights-intelligence/intelligence/risk-alerts/wip10011974924/netherlands-authorities-announce-tightening-of-international-entry-and-domestic-restrictions-jan-20-due-to-covid-19-update-23,,,,
Netherlands,21-Jan,Coronavirus in the Netherlands: What you need to know (January 22),https://www.dutchnews.nl/news/2021/01/coronavirus-in-the-netherlands-what-you-need-to-know-january-20/,,,,
Italy,21-Jan,Italian Tourism Federation Urges Government to Create ‘COVID-19 Vaccination Certificate’,https://www.schengenvisainfo.com/news/italian-tourism-federation-urges-government-to-create-covid-19-vaccination-certificate/,,,,
Italy,21-Jan,"COVID-19 and Italian Healthcare Workers From the Initial Sacrifice to the mRNA Vaccine: Pandemic Chrono-History, Epidemiological Data, Ethical Dilemmas, and Future Challenges",https://www.frontiersin.org/articles/10.3389/fpubh.2020.591900/full,,,,
Italy,21-Jan,"Italy: New Decree dated January 14, 2021, with COVID-19 measures ",https://www.lexology.com/library/detail.aspx?g=54650d09-7722-4b90-841a-c23bdc5e4e32,,,,
Italy,21-Jan,"Italy Hits 1 Million COVID-19 Vaccinations, Most in the E.U.",https://www.travelagentcentral.com/europe/italy-hits-1-million-covid-19-vaccinations-most-e-u,,,,
Italy,21-Jan,"COVID-19 Lockdown Took Heavy Toll on Patients, Italian Study Finds",https://parkinsonsnewstoday.com/2021/01/20/covid-19-lockdown-worsens-cognitive-behavioral-motor-symptoms-study-in-italy/,,,,
Germany,21-Jan,France may follow Germany in making clinical masks mandatory,https://www.theguardian.com/world/2021/jan/20/france-may-follow-germany-in-making-clinical-masks-mandatory,,,,
Germany,21-Jan,COVID-19: New COVID-19 Workplace Regulation for Employers in Germany Brings Home Office and Further Health and Safety Obligations | Germany,https://iclg.com/briefing/15497-covid-19-new-covid-19-workplace-regulation-for-employers-in-germany-brings-home-office-and-further-health-and-safety-obligations-germany,,,,
Germany,21-Jan,How to Move to Germany During Covid-19,https://www.archer-relocation.com/how-to-move-to-germany-during-covid-19/,,,,
Germany,21-Jan,"Coronavirus: Germany extends lockdown, Netherlands sets nighttime curfew over variants fears",https://www.euronews.com/2021/01/20/coronavirus-germany-tightens-restrictions-and-netherlands-mulls-curfew-over-variants-fears,,,,
Germany,21-Jan,"Opinion: Sit tight until summer, amid Germany's lockdown",https://www.dw.com/en/opinion-sit-tight-until-summer-amid-germanys-lockdown/a-56281734,,,,
Spain,21-Jan,"COVID-19: Spain sees record cases, deaths pass 55,000",https://www.aa.com.tr/en/europe/covid-19-spain-sees-record-cases-deaths-pass-55-000/2118702,,,,
Spain,21-Jan,"Sanchez praises EU unity, insists Spain will implement COVID recovery funds",https://www.euractiv.com/section/economy-jobs/news/sanchez-praises-eu-unity-insists-spain-will-implement-covid-recovery-funds/,,,,
Spain,21-Jan,"Spain reports highest weekly figure of new coronavirus cases so far: 233,523",https://english.elpais.com/society/2021-01-20/spain-reports-highest-weekly-figure-of-new-coronavirus-cases-so-far-233523.html,,,,
Spain,21-Jan,Spain headed toward de facto lockdown amid surge in coronavirus cases,https://english.elpais.com/society/2021-01-20/spain-headed-toward-de-facto-lockdown-amid-surge-in-coronavirus-cases.html,,,,
Spain,21-Jan,Spain refuses new measures despite record virus cases,https://www.aa.com.tr/en/europe/spain-refuses-new-measures-despite-record-virus-cases/2117324,,,,
France,21-Jan,"Covid France: Five deaths after vaccine, no link proven",https://www.connexionfrance.com/French-news/Five-deaths-in-France-reported-after-Covid-Pfizer-BioNTech-vaccination,,,,
France,21-Jan,Covid France: Will I get proof of my vaccination?,https://www.connexionfrance.com/Practical/Your-Questions/Covid-France-Will-I-get-proof-of-my-vaccination,,,,
France,21-Jan,"France to keep ski lifts shut due to Covid-19, in blow to winter sports tourism",https://www.france24.com/en/europe/20210120-france-to-keep-ski-lifts-shut-due-to-covid-19-in-blow-to-winter-sports-tourism,,,,
France,21-Jan,Covid-19: France aims to vaccinate entire population by end of August,https://www.france24.com/en/europe/20210121-france-s-health-minister-says-vaccination-goal-is-70-million-by-end-of-august,,,,
France,21-Jan,Coronavirus: French students highlight pandemic's mental health toll,https://www.bbc.com/news/world-europe-55716340,,,,
UK,21-Jan,COVID-19: UK to look 'very carefully' at vaccine dosing after concerns raised over level of protection,https://news.sky.com/story/covid-19-uk-to-look-very-carefully-at-vaccine-dosing-after-concerns-raised-over-level-of-protection-12193205,,,,
UK,21-Jan,"COVID-19: 1,820 more coronavirus deaths in UK - highest number reported on a single day",https://news.sky.com/story/covid-19-1-820-more-coronavirus-deaths-in-uk-highest-number-reported-on-a-single-day-12193513,,,,
UK,21-Jan,"UK reports 1,820 more Covid deaths, the most recorded in one day",https://www.ons.gov.uk/peoplepopulationandcommunity/birthsdeathsandmarriages/deaths/bulletins/deathsregisteredweeklyinenglandandwalesprovisional/weekending15january2021,,,,
UK,21-Jan,"Covid: UK reports 1,820 deaths as Johnson warns tough weeks to come",https://www.bbc.com/news/uk-55738174,,,,
UK,21-Jan,Highest daily Covid deaths recorded in UK,https://www.itv.com/news/2021-01-27/covid-deaths-increase-by-1725-as-25308-new-coronavirus-cases-reported,,,,
Netherlands,14-Jan,Getting vaccinated against COVID-19: how does it work?,https://www.government.nl/topics/coronavirus-covid-19/dutch-vaccination-programme/getting-vaccinated-against-covid-19,,,,
Netherlands,14-Jan,"Rapid test compulsory for people entering the Netherlands from the UK, Ireland and South Africa",https://www.government.nl/topics/coronavirus-covid-19/dutch-vaccination-programme/getting-vaccinated-against-covid-19,,,,
Netherlands,14-Jan,Netherlands Begins Mass Testing to Isolate COVID-19 Variant ,https://www.voanews.com/covid-19-pandemic/netherlands-begins-mass-testing-isolate-covid-19-variant,,,,
Netherlands,14-Jan,Netherlands imposes mandatory Covid rapid testing for inbound travel,https://www.nautilusint.org/en/news-insight/news/netherlands-imposes-mandatory-covid-rapid-testing-for-inbound-travel/,,,,
Netherlands,14-Jan,"Netherlands Imposes Compulsory Rapid Tests for Citizens of UK, Ireland & South Africa",https://www.schengenvisainfo.com/news/netherlands-imposes-compulsory-rapid-tests-for-citizens-of-uk-ireland-south-africa/,,,,
Italy,14-Jan,Italy to extend COVID state of emergency to end of April,https://www.wantedinrome.com/news/italy-to-extend-covid-19-state-of-emergency-until-30-april.html,,,,
Italy,14-Jan,Italy political crisis erupts over EU Covid spending,https://www.bbc.com/news/world-europe-55661781,,,,
Italy,14-Jan,Fresh evidence emerges of COVID-19 in Italy earlier than first thought,https://newseu.cgtn.com/news/2021-01-13/Fresh-evidence-emerges-of-COVID-19-in-Italy-earlier-than-first-thought-X08i0uNmBq/index.html,,,,
Italy,14-Jan,Italy to extend covid-19 state of emergency until 30 April,https://www.wantedinrome.com/news/italy-to-extend-covid-19-state-of-emergency-until-30-april.html,,,,
Italy,14-Jan,"Italy: Covid-19 – New restrictive measures enacted – Decree of December 3, 2020",https://globalcompliancenews.com/italy-covid-19-new-restrictive-measures-enacted-decree-of-december-3-2020-05122020/,,,,
Germany,14-Jan,Germany battles one of the toughest pandemic stages — health minister,https://www.dw.com/en/germany-battles-one-of-the-toughest-pandemic-stages-health-minister/a-56209728,,,,
Germany,14-Jan,COVID city limits: Berlin to restrict how far you can travel,https://www.dw.com/en/covid-city-limits-berlin-to-restrict-how-far-you-can-travel/a-56211952,,,,
Germany,14-Jan,Germany will have COVID curbs beyond January - health minister,https://www.reuters.com/article/us-health-coronavirus-germany-spahn-idUSKBN29I0TI,,,,
Germany,14-Jan,German gov’t turns down compulsory vaccination proposal,https://www.aa.com.tr/en/europe/german-gov-t-turns-down-compulsory-vaccination-proposal/2108543,,,,
Germany,14-Jan,Covid contraction shrinks German economy by 5%,https://www.bbc.com/news/business-55662545,,,,
Spain,14-Jan,Spain shatters record for new coronavirus infections,https://www.aa.com.tr/en/europe/spain-shatters-record-for-new-coronavirus-infections/2109135,,,,
Spain,14-Jan,"Mortality rate of coronavirus (COVID-19) in Spain as of November 24, 2020, by age group ",https://www.statista.com/statistics/1105596/covid-19-mortality-rate-by-age-group-in-spain-march/,,,,
Spain,14-Jan,"Number of people who recovered from coronavirus (COVID-19) in Spain between March 9 and May 18, 2020 ",https://www.statista.com/statistics/1104641/persons-with-covid-19-recovered-by-day-spain/,,,,
Spain,14-Jan,Spain rejects virus confinement as most of Europe stays home,https://apnews.com/article/spain-coronavirus-news-6186fece500a711d6180502f7c51998e,,,,
Spain,14-Jan,"Spain reports 38,869 new coronavirus cases in a day, a new record high",https://english.elpais.com/society/2021-01-14/spain-reports-38869-new-coronavirus-cases-in-a-day-a-new-record-high.html,,,,
France,14-Jan,Covid-19: France PM Castex announces tighter curfew,https://www.bbc.com/news/world-europe-55669172,,,,
France,14-Jan,"Covid-19: No need to close schools over UK variant, says French scientific adviser",https://www.france24.com/en/france/20210113-covid-19-no-need-to-close-schools-over-uk-variant-says-french-scientific-advisor,,,,
France,14-Jan,UPDATE 1-No need to close schools in France despite COVID variant-adviser,https://www.reuters.com/article/health-coronavirus-france-idUSL8N2JO2GL,,,,
