Country,Date,Headline,Link,,,,
UK,07-Apr,COVID news live - latest updates: New UK guidance on AstraZeneca-Oxford vaccine over blood clot 'link',https://news.sky.com/story/covid-news-live-latest-uk-updates-coronavirus-robustly-associated-with-risk-of-psychiatric-and-neurological-conditions-12268094,,,,
UK,07-Apr,COVID-19: Number of daily first vaccine doses in UK falls to lowest since early January,https://news.sky.com/story/covid-19-number-of-daily-first-vaccine-doses-in-uk-falls-to-lowest-since-early-january-12267624,,,,
Netherlands,01-Apr,Netherlands cuts nightly curfew by an hour despite rising Covid cases,https://www.irishtimes.com/news/world/europe/netherlands-cuts-nightly-curfew-by-an-hour-despite-rising-covid-cases-1.4525412,,,,
Netherlands,01-Apr,Fifteen hundred party at music festival with Covid testing,https://www.avinteractive.com/markets/live-events/fifteen-hundred-party-pilot-music-festival-covid-testing-31-03-2021/,,,,
Netherlands,01-Apr,Caribbean Netherlands: Authorities maintain in place COVID-19-related international travel protocols as of March 31 /update 17,https://www.garda.com/crisis24/news-alerts/461996/caribbean-netherlands-authorities-maintain-in-place-covid-19-related-international-travel-protocols-as-of-march-31-update-17,,,,
Netherlands,01-Apr,First Covid self-tests now available at Dutch pharmacies,https://www.garda.com/crisis24/news-alerts/461996/caribbean-netherlands-authorities-maintain-in-place-covid-19-related-international-travel-protocols-as-of-march-31-update-17,,,,
Netherlands,01-Apr,COVID-19 #18 | Netherlands’ agreement with Belgium extended until 1 July 2021,https://limes-int.com/covid-19-18-netherlands-agreement-with-belgium-extended-until-1-july-2021/,,,,
Italy,01-Apr,Italy Pushes Back as Health Care Workers Shun Covid Vaccines,https://www.nytimes.com/2021/03/31/world/europe/italy-covid-vaccines-health-workers.html,,,,
Italy,01-Apr,Italy extends coronavirus restrictions through April,https://medicalxpress.com/news/2021-03-italy-coronavirus-restrictions-april.html,,,,
Italy,01-Apr,Italy makes COVID-19 vaccine mandatory for all health workers,https://www.ctvnews.ca/health/coronavirus/italy-makes-covid-19-vaccine-mandatory-for-all-health-workers-1.5370115,,,,
Italy,01-Apr,COVID-19 information for the EUI community and visitors,https://www.eui.eu/en/public/covid-19-information,,,,
Italy,01-Apr,Italy makes COVID-19 vaccine mandatory for all health workers,https://www.reuters.com/article/us-health-coronavirus-italy-vaccine-idUSKBN2BN34F,,,,
Germany,01-Apr,Germany's COVID vaccinations hit Easter snag,https://www.dw.com/en/germanys-covid-vaccinations-hit-easter-snag/a-57064215,,,,
Germany,01-Apr,Germany Now Requires Compulsory Test Results for All Incoming Flight Passengers,https://www.schengenvisainfo.com/news/germany-now-requires-compulsory-test-results-for-all-incoming-flight-passengers/,,,,
Germany,01-Apr,Leaders of Covid-hit German states call for national lockdown,https://www.theguardian.com/world/2021/mar/31/germany-restricts-use-of-astrazeneca-jab-to-over-60s,,,,
Germany,01-Apr,Germany’s COVID sceptics fuelled by Russian media and far-Right conspiracies,https://www.opendemocracy.net/en/germanys-covid-sceptics-fuelled-by-russian-media-and-far-right-conspiracies/,,,,
Germany,01-Apr,Covid-19: EMA defends AstraZeneca vaccine as Germany and Canada halt rollouts,https://www.bmj.com/content/373/bmj.n883,,,,
Spain,01-Apr,Spain's infection rate moves into 'high risk' range,https://www.aa.com.tr/en/latest-on-coronavirus-outbreak/spains-infection-rate-moves-into-high-risk-range/2194446,,,,
Spain,01-Apr,Spanish Government urged to guarantee the right of access to information during the Covid-19 crisis,https://www.access-info.org/2020-04-27/spain-guarantee-access-information-covid19/,,,,
Spain,01-Apr,Fears of fourth coronavirus wave grow as Spain enters high-risk situation,https://english.elpais.com/society/2021-04-01/fears-of-fourth-coronavirus-wave-grow-as-spain-enters-high-risk-situation.html,,,,
Spain,01-Apr,"Spain reports 4,994 new coronavirus cases as seven territories enter high-risk level",https://english.elpais.com/society/2021-03-31/spain-reports-4994-new-coronavirus-cases-as-seven-territories-enter-high-risk-level.html,,,,
Spain,01-Apr,COVID-19: Digital vaccine certificates to help European travel 'ready in June at latest',https://news.sky.com/story/covid-19-digital-vaccine-certificates-to-be-ready-in-june-at-latest-says-spain-12261459,,,,
France,01-Apr,Covid: France schools to close under third lockdown,https://www.bbc.com/news/world-europe-56597319,,,,
France,01-Apr,France faces tough choice to slow down COVID infections,https://www.dw.com/en/france-faces-tough-choice-to-slow-down-covid-infections/a-57061128,,,,
France,01-Apr,"France to close schools and extend Covid-19 lockdown to all of the country, Macron says",https://www.france24.com/en/france/20210331-live-macron-addresses-france-as-covid-19-cases-resurge,,,,
France,01-Apr,Macron to address nation as France’s Covid-19 surge draws fire from critics,https://www.france24.com/en/france/20210331-macron-to-address-nation-as-france-s-covid-19-surge-draws-fire-from-critics,,,,
France,01-Apr,France to close schools and stop domestic travel after Covid surge,https://www.theguardian.com/world/2021/mar/31/macron-to-unveil-tough-measures-as-covid-cases-surge-in-france,,,,
UK,01-Apr,COVID-19: Malta to welcome fully vaccinated UK holidaymakers from June,https://news.sky.com/story/malta-to-welcome-fully-vaccinated-uk-holidaymakers-from-june-12261910,,,,
UK,01-Apr,Almost third of UK Covid hospital patients readmitted within four months,https://www.theguardian.com/world/2021/apr/01/almost-third-of-uk-covid-hospital-patients-readmitted-within-four-months,,,,
UK,01-Apr,Covid: Children 'well protected by Pfizer vaccine',https://www.bbc.com/news/health-56591429,,,,
UK,01-Apr,"UK COVID-19 Update: Germany Suspends Oxford Vaccine for Under-60s, and 'Third Wave' Intensifies in France",https://www.medscape.com/viewarticle/948345,,,,
UK,01-Apr,"Covid-19: Mass testing at UK universities is haphazard and unscientific, finds BMJ investigation",https://www.bmj.com/content/372/bmj.n848,,,,
Netherlands,28-Mar,Dutch people are partying like it's 2019,https://edition.cnn.com/travel/article/netherlands-festivals-intl/index.html,,,,
Netherlands,28-Mar,Netherlands: Churchgoers breaking COVID rules attack journalists,https://www.dw.com/en/netherlands-churchgoers-breaking-covid-rules-attack-journalists/a-57033027,,,,
Netherlands,28-Mar,Covid rapid test initiative aims to speed up spectators' return to big events,https://www.rfi.fr/en/europe/20210327-speedy-covid-testing-initiative-could-help-return-spectators-to-big-events-netherlands-europe-sports-fieldlab,,,,
Netherlands,28-Mar,"New Dutch coronavirus cases above 8,500, most since January -data",https://www.reuters.com/article/health-coronavirus-netherlands-tally-idUSS8N2JI06Q,,,,
Netherlands,28-Mar,Covid infections up 15% this week; Hospital cases up 8%,https://nltimes.nl/2021/03/28/covid-infections-15-week-hospital-cases-8,,,,
Italy,28-Mar,Italy: Hope and mourning in Bergamo,https://www.dw.com/en/italy-hope-and-mourning-in-bergamo/av-56911103,,,,
Italy,28-Mar,"UPDATE 1-Italy reports 297 coronavirus deaths and 19,611 new cases",https://www.reuters.com/article/health-coronavirus-italy-tally-idUSL1N2LQ0AR,,,,
Italy,28-Mar,Mystery of Italian Town’s 29 Million Shots Strains EU-Astra Ties,https://www.bloomberg.com/news/articles/2021-03-28/mystery-of-italian-town-s-29-million-shots-strains-eu-astra-ties,,,,
Italy,28-Mar,Italy: COVID-19 – The Ministry of Health prohibits the marketing and orders the withdrawal of medical devices irregularly placed on the Italian market,https://globalcompliancenews.com/italy-covid-19-prohibits-marketing-and-withdraws-medical-devices-irregulary-placed-on-italian-market090321/,,,,
Italy,28-Mar,COVID: Downward trend in Italy's population continues,https://www.aa.com.tr/en/europe/covid-downward-trend-in-italys-population-continues/2189712,,,,
Germany,28-Mar,COVID: German doctors call for 2-week hard lockdown,https://www.dw.com/en/covid-german-doctors-call-for-2-week-hard-lockdown/a-57023394,,,,
Germany,28-Mar,Coronavirus: Merkel aide warns of vaccine-resistant mutations,https://www.dw.com/en/coronavirus-merkel-aide-warns-of-vaccine-resistant-mutations/a-57029027,,,,
Germany,28-Mar,Heroes to zeros: how German perfectionism wrecked its Covid vaccine drive,https://www.theguardian.com/world/2021/mar/27/heroes-to-zeros-how-german-efficiency-wrecked-its-covid-vaccine-drive,,,,
Germany,28-Mar,"German Covid Easter U-turn shakes Merkel's cool, calm image",https://www.bbc.com/news/world-europe-56537390,,,,
Germany,28-Mar,"Germany must suppress virus now or risk losing control, Merkel aide says",https://www.reuters.com/article/us-health-coronavirus-germany-idUSKBN2BJ0Q0,,,,
Spain,28-Mar,"Spurred by Lockdown, Spain Gives 4-day Week a Try",https://www.voanews.com/covid-19-pandemic/spurred-lockdown-spain-gives-4-day-week-try,,,,
Spain,28-Mar,COVID-19: Spain to trial four-day working week in bid to prevent new coronavirus outbreaks,https://news.sky.com/story/covid-19-spain-to-trial-four-day-working-week-in-bid-to-prevent-new-coronavirus-outbreaks-12258129,,,,
Spain,28-Mar,Spain to require arrivals by land from France to present negative COVID test,https://www.reuters.com/article/us-health-coronavirus-spain-idUSKBN2BJ0B6,,,,
Spain,28-Mar,Covid: Barcelona hosts large gig after testing crowd,https://www.bbc.com/news/world-europe-56556451,,,,
Spain,28-Mar,Thousands attend rock concert in Barcelona in COVID screening test,https://www.euronews.com/2021/03/27/thousands-to-watch-rock-concert-in-barcelona-in-covid-screening-test,,,,
France,28-Mar,The vaccine misinformation battle raging in France,https://www.bbc.com/news/blogs-trending-56526265,,,,
France,28-Mar,"Paris doctors sound alarm, warn of catastrophic overload of Covid-19 cases",https://www.france24.com/en/europe/20210328-paris-doctors-sound-alarm-warn-of-catastrophic-overload-of-covid-19-cases,,,,
France,28-Mar,"French COVID-19 patient numbers rise again, adding to pressure for new lockdown",https://www.france24.com/en/europe/20210328-paris-doctors-sound-alarm-warn-of-catastrophic-overload-of-covid-19-cases,,,,
France,28-Mar,France accelerates vaccine rollout – as it happened,https://www.theguardian.com/world/live/2021/mar/28/coronavirus-live-news-germany-risks-losing-control-of-covid-brazil-deaths-top-3000-for-second-day,,,,
France,28-Mar,"EU countries tighten Covid restrictions, France 'critical'",https://www.rfi.fr/en/european-countries-tighten-virus-curbs-france-critical,,,,
UK,28-Mar,"UK Covid deaths pass 150,000 milestone, analysis shows",https://www.theguardian.com/world/2021/mar/27/uk-covid-deaths-pass-150000-milestone-analysis-shows,,,,
UK,28-Mar,Covid: What's happened to crime during the pandemic?,https://www.bbc.com/news/56463680,,,,
UK,28-Mar,Covid: Boris Johnson urged to share vaccines with poorer nations,https://www.bbc.com/news/uk-56552966,,,,
UK,28-Mar,"COVID-19: UK reports 58 deaths and 4,715 cases in latest 24-hour period",https://news.sky.com/story/covid-19-uk-reports-58-deaths-and-4-715-cases-in-latest-24-hour-period-12258248,,,,
UK,28-Mar,COVID-19: UK hits 30 million first coronavirus vaccine doses - 57% of all adults,https://news.sky.com/story/covid-19-uk-hits-30-million-first-vaccine-doses-12259255,,,,
Netherlands,21-Mar,Netherlands trials new COVID-19 app at pilot music festivals ,https://www.euronews.com/2021/03/21/netherlands-trials-new-covid-19-app-at-pilot-music-festivals,,,,
Netherlands,21-Mar,Netherlands reports highest daily rise in COVID-19 cases since early January,https://newsaf.cgtn.com/news/2021-03-20/Netherlands-reports-highest-daily-rise-in-cases-since-early-January-YLLoCQB6U0/index.html,,,,
Netherlands,21-Mar,New Covid-19 cases hit highest number since January 9; hospitalizations also on steady rise,https://nltimes.nl/2021/03/20/new-covid-19-cases-hit-highest-number-since-january-9-hospitalizations-also-steady-rise,,,,
Netherlands,21-Mar,Seven-day average highest since mid-January; experts say it's too early to relax covid restrictions,https://nltimes.nl/2021/03/21/seven-day-average-highest-since-mid-january-experts-say-its-early-relax-covid,,,,
Netherlands,21-Mar,"Coronavirus upward trend continues, rules won’t be relaxed for Easter",https://www.dutchnews.nl/news/2021/03/coronavirus-upward-trend-continues-rules-wont-be-relaxed-for-easter/,,,,
Italy,21-Mar,"Italy reports 401 coronavirus deaths, 23,832 new cases",https://www.usnews.com/news/world/articles/2021-03-20/italy-reports-401-coronavirus-deaths-23-832-new-cases,,,,
Italy,21-Mar,He covered the Covid crisis in Italy. Then the disease became personal.,https://www.nbcnews.com/news/world/he-covered-covid-crisis-italy-then-disease-became-personal-n1261318,,,,
Italy,21-Mar,Italy's elders in danger of COVID-19 as vaccinations delayed ,https://www.dailysabah.com/world/europe/italys-elders-in-danger-of-covid-19-as-vaccinations-delayed,,,,
Italy,21-Mar,COVID-19 pandemic leaves Italy scrambling to catch up digitally,https://www.channelnewsasia.com/news/business/covid-19-pandemic-italy-scrambling-catch-up-digitally-14457982,,,,
Italy,21-Mar,"Italy Reports 401 Coronavirus Deaths, 23,832 New Cases",https://www.usnews.com/news/world/articles/2021-03-20/italy-reports-401-coronavirus-deaths-23-832-new-cases,,,,
Germany,21-Mar,Emerging COVID-19 success story: Germany’s strong enabling environment,https://ourworldindata.org/covid-exemplar-germany-2020,,,,
Germany,21-Mar,"Germany's COVID rate exceeds critical 100 in 100,000 rate",https://www.dw.com/en/germanys-covid-rate-exceeds-critical-100-in-100000-rate/a-56942467,,,,
Germany,21-Mar,Germany: Anti-lockdown protest turns violent in Kassel,https://www.dw.com/en/germany-anti-lockdown-protest-turns-violent-in-kassel/a-56938225,,,,
Germany,21-Mar,German police clash with protesters over Covid-19 restrictions,https://www.france24.com/en/europe/20210320-german-police-clash-with-protesters-over-covid-19-restrictions,,,,
Germany,21-Mar,BioNTech Founder: We Can Get Most Germans Vaccinated by Summer's End,https://www.voanews.com/covid-19-pandemic/biontech-founder-we-can-get-most-germans-vaccinated-summers-end,,,,
Spain,21-Mar,"Covid: Summer holidays abroad 'unlikely', warns government adviser",https://www.bbc.com/news/uk-56467813,,,,
Spain,21-Mar,Macroeconomic lockdown and SMEs: the impact of the COVID-19 pandemic in Spain,https://www.researchgate.net/publication/349833002_Macroeconomic_lockdown_and_SMEs_the_impact_of_the_COVID-19_pandemic_in_Spain,,,,
Spain,21-Mar,"Lower Spanish growth expected this year, bank governor says, with hopes pinned on vaccine rollout",https://www.reuters.com/article/us-spain-economy-bank-idUSKBN2B60AV,,,,
Spain,21-Mar,COVID-19: Spanish Press Dubs Morocco ‘Miracle Country’ for Vaccines,https://www.moroccoworldnews.com/2021/03/337229/covid-19-spanish-press-dubs-morocco-miracle-country-for-vaccines-2,,,,
Spain,21-Mar,Switzerland removes Spain from Covid risk list,https://www.schengenvisainfo.com/news/switzerland-removes-12-countries-several-regions-of-italy-austria-from-its-list-of-high-risk-countries/,,,,
France,21-Mar,Covid: France and Poland increase lockdown measures as infections surge,https://www.bbc.com/news/world-europe-56466223,,,,
France,21-Mar,"Inter-regional travel banned, schools remain open: France’s new partial lockdown rules",https://www.france24.com/en/france/20210320-inter-regional-travel-prohibited-schools-remain-open-france-s-new-partial-lockdown-rules,,,,
France,21-Mar,COVID-19 in Europe: France and Poland begin new lockdowns to stem soaring infections,https://www.euronews.com/2021/03/20/covid-19-in-europe-france-and-poland-begin-new-lockdowns-to-stem-soaring-infections,,,,
France,21-Mar,"New Covid rules France: Revised form, more shops to open",https://www.connexionfrance.com/French-news/New-Covid-rules-France-Revised-form-more-shops-to-open,,,,
France,21-Mar,France reports COVID-19 patients in intensive care at new 2021 high,https://www.reuters.com/article/us-health-coronavirus-france-casualties-idUSKBN2BC0O7,,,,
UK,21-Mar,"Covid-19: Record day for UK with 711,156 vaccinations given",https://www.bbc.com/news/uk-56469092,,,,
UK,21-Mar,Covid-19: Have a million people left the UK?,https://www.bbc.com/news/uk-56435100,,,,
UK,21-Mar,Michael Rosen backs calls for Covid UK public inquiry,https://www.theguardian.com/uk-news/2021/mar/20/michael-rosen-backs-calls-for-covid-uk-public-inquiry,,,,
UK,21-Mar,"Covid rise in Europe makes foreign holidays unlikely, UK experts warn",https://www.theguardian.com/world/2021/mar/20/covid-rise-europe-may-thwart-uk-plans-ease-lockdown-experts,,,,
UK,21-Mar,"COVID-19: Half of UK adults have received first vaccine dose, government says",https://news.sky.com/story/covid-19-half-of-uk-adults-have-received-first-vaccine-dose-health-secretary-says-12247856,,,,
Netherlands,14-Mar,Covid-19: Dutch police break up anti-lockdown protest,https://www.bbc.com/news/world-europe-56393820,,,,
Netherlands,14-Mar,Dutch elections: How COVID-19 salvaged Mark Rutte's bid amid scandal,https://www.dw.com/en/dutch-elections-how-covid-19-salvaged-mark-ruttes-bid-amid-scandal/a-56812885,,,,
Netherlands,14-Mar,Netherlands halts use of AstraZeneca COVID-19 vaccine,https://www.reuters.com/article/us-health-coronavirus-netherlands-idUSKBN2B60OV,,,,
Netherlands,14-Mar,Coronavirus pandemic casts long shadow over Dutch elections,https://apnews.com/article/mark-rutte-netherlands-health-elections-coronavirus-pandemic-04a5a2c89daf36c139a9c53f9a0e8796,,,,
Netherlands,14-Mar,Netherlands joins Ireland in vaccine suspension over blood clot concerns,https://www.theguardian.com/world/2021/mar/14/ireland-suspends-oxford-astrazeneca-covid-vaccine-over-blood-clot-concerns,,,,
Italy,14-Mar,Italy to Carry Out COVID-Tested Flights From US to Milan,https://www.schengenvisainfo.com/news/italy-to-carry-out-covid-tested-flights-from-us-to-milan/,,,,
Italy,14-Mar,Italy prepares for Easter lockdown as COVID cases grow exponentially,https://abc7news.com/italy-lockdown-covid-coronavirus-2021/10414605/,,,,
Italy,14-Mar,Covid-19 pandemic: Italy to shut shops and schools amid infection spike,https://www.bbc.com/news/world-europe-56382608,,,,
Italy,14-Mar,Italy aims to vaccinate at least 80% of population by end of September,https://www.reuters.com/article/us-health-coronavirus-italy-vaccines-idUSKBN2B50L0,,,,
Italy,14-Mar,China Eases Visitor Entry; Italy Aims for 80% of Shots by Fall,https://www.voanews.com/covid-19-pandemic/china-eases-visitor-entry-italy-aims-80-shots-fall,,,,
Germany,14-Mar,Coronavirus digest: Germany's incidence rate rises sharply,https://www.dw.com/en/coronavirus-digest-germanys-incidence-rate-rises-sharply/a-56860922,,,,
Germany,14-Mar,Germany: Protests against coronavirus restrictions leave 12 Dresden officers injured,https://www.dw.com/en/germany-protests-against-coronavirus-restrictions-leave-12-dresden-officers-injured/a-56866499,,,,
Germany,14-Mar,German COVID cases could revisit December peak in April,https://www.reuters.com/article/us-health-coronavirus-germany-idUSKBN2B50B5,,,,
Germany,14-Mar,Germany: Opponents of Covid-19 control measures demonstrate ,https://www.brusselstimes.com/news/world-all-news/159778/germany-opponents-of-covid-19-control-measures-demonstrate/,,,,
Germany,14-Mar,Germany: Experts warn against easing of lockdown as Covid-19 cases jump,https://www.hindustantimes.com/world-news/germany-experts-warn-against-easing-of-lockdown-as-covid-19-cases-jump-101615634582799.html,,,,
Spain,14-Mar,Spain: Tourist hotspot Madrid,https://www.dw.com/en/spain-tourist-hotspot-madrid/av-56861627,,,,
Spain,14-Mar,A year of Covid-19 in Catalonia: where are we now?,https://www.catalannews.com/covid-19/item/a-year-of-covid-19-in-catalonia-where-are-we-now,,,,
Spain,14-Mar,Spain Coronavirus response and implications for business,https://www.hlb.global/spain-coronavirus-response-and-implications-for-business/,,,,
Spain,14-Mar,Spain COVID-19 Employer Resources,https://www.asinta.com/news/spain-covid-19-employer-resources/,,,,
Spain,14-Mar,"Lower Spanish growth expected this year, bank governor says, with hopes pinned on vaccine rollout",https://www.reuters.com/article/us-spain-economy-bank-idUSKBN2B60AV,,,,
France,14-Mar,"Covid-19 situation in Paris area is extremely tense, French PM says",https://www.france24.com/en/france/20210313-covid-19-situation-in-paris-area-is-extremely-tense-french-pm-says,,,,
France,14-Mar,"COVID in Europe: Italy, France concerned over rising cases, Portugal plans to loosen restrictions",https://www.euronews.com/2021/03/13/covid-in-europe-italy-france-concerned-over-rising-cases-portugal-plans-to-loosen-restrict,,,,
France,14-Mar,"French coronavirus cases near 30,000 as vaccinations top 5 million",https://www.reuters.com/article/us-health-coronavirus-france-idUSKBN2B50N8,,,,
France,14-Mar,France raises prospect of mandatory Covid-19 jabs for healthcare staff ,https://www.ft.com/content/cebe8cf7-fe2c-4420-95d0-0eb32ddb1497,,,,
France,14-Mar,France to trial digital vaccine passport scheme,https://www.healthcareitnews.com/news/emea/france-trial-digital-vaccine-passport-scheme,,,,
UK,14-Mar,Covid-19: UK national day of reflection to be held on 23 March,https://www.bbc.com/news/uk-56379232,,,,
UK,14-Mar,EU closes ranks over Covid surge and vaccine delays,https://www.bbc.com/news/world-europe-56361840,,,,
UK,14-Mar,UK COVID-19 research passes one million participants,https://www.nihr.ac.uk/news/uk-covid-19-research-passes-one-million-participants/27215?utm_source=twitter-research&utm_medium=social&utm_campaign=covid&utm_content=1millionnews,,,,
UK,14-Mar,Government will have to take heed if Covid calls time on more UK pubs,https://www.theguardian.com/business/2021/mar/14/government-will-have-to-take-heed-if-covid-calls-time-on-more-uk-pubs,,,,
UK,14-Mar,"4,618 new cases and 52 more deaths in UK – as it happened",https://www.theguardian.com/world/live/2021/mar/14/coronavirus-live-news-astrazeneca-reports-vaccine-shortfall-to-eu-sydney-hotel-quarantine-worker-tests-positive,,,,
Netherlands,07-Mar,Dutch clubbers hit dancefloor for study into easing lockdown,https://www.theguardian.com/world/2021/mar/07/dutch-clubbers-dance-study-easing-lockdown-music-event-coronavirus,,,,
Netherlands,07-Mar,Urban Sun': Dutch artists launches UV light installation to 'clean' public spaces of COVID-19,https://abc7chicago.com/covid-uv-light-artists-dutch/10393906/,,,,
Netherlands,07-Mar,Swabs are passé: Dutch inventor's new Covid test involves screaming or singing in an air-locked cabin,https://economictimes.indiatimes.com/magazines/panache/swabs-are-pass-dutch-inventors-new-covid-test-involves-screaming-or-singing-in-an-air-locked-cabin/articleshow/81347267.cms,,,,
Netherlands,07-Mar,Dutch dance lovers offered lockdown relief at test event,https://www.reuters.com/article/us-health-coronavirus-netherlands-dance-idUSKBN2AZ08X,,,,
Netherlands,07-Mar,Revelers in Amsterdam hit dancefloor for club night experiment ,https://www.euronews.com/2021/03/07/revelers-in-amsterdam-hit-dancefloor-for-club-night-experiment,,,,
Italy,07-Mar,Italy’s Warning: Covid Cases Spike Again As Vaccine Rollout Lags,https://www.forbes.com/sites/joewalsh/2021/03/06/italys-warning-covid-cases-spike-again-as-vaccine-rollout-lags/,,,,
Italy,07-Mar,Covid Drug ‘80 Times More Potent Than Trump’s’ in Test in Italy,https://www.bloombergquint.com/coronavirus-outbreak/covid-drug-80-times-more-potent-than-trump-s-in-test-in-italy,,,,
Italy,07-Mar,Italy tightens Covid restrictions in more regions as the infection rates rise,https://www.lifeinitaly.com/news/italy-tightens-covid-restrictions-in-more-regions-as-the-infection-rates-rise/,,,,
Italy,07-Mar,"Italy reports 307 coronavirus deaths on Saturday, 23,641 new cases",https://www.livemint.com/news/world/italy-reports-307-coronavirus-deaths-on-saturday-23-641-new-cases-11615050759179.html,,,,
Italy,07-Mar,"Italian lab develops monoclonal antibodies, one of the most effective Covid-19 treatments ","https://www.thepeninsulaqatar.com/article/06/03/2021/Italian-lab-develops-monoclonal-antibodies,-one-of-the-most-effective-Covid-19-treatments",,,,
Germany,07-Mar,Coronavirus digest: Germany accepts COVID patients from Slovakia,https://www.dw.com/en/coronavirus-digest-germany-accepts-covid-patients-from-slovakia/a-56791123,,,,
Germany,07-Mar,Fact check: Is Germany throwing away vaccine doses? ,https://www.dw.com/en/fact-check-is-germany-throwing-away-vaccine-doses/a-56796428,,,,
Germany,07-Mar,Germany hopes for opening-up by late May ,https://www.euronews.com/2021/03/06/germany-hopes-for-opening-up-by-late-may,,,,
Germany,07-Mar,Germany COVID-19 lockdown one year on: What changed in the country? ,https://news.cgtn.com/news/2021-03-07/Germany-COVID-19-lockdown-one-year-on-What-changed-in-the-country--YqSDC6bEdO/index.html,,,,
Germany,07-Mar,Europe Staggers as Infectious Variants Power Virus Surge,https://www.voanews.com/covid-19-pandemic/europe-staggers-infectious-variants-power-virus-surge,,,,
Spain,07-Mar,Coronavirus: Europe in vaccine race to save summer,https://www.bbc.com/news/world-europe-56292087,,,,
Spain,07-Mar,Spain: Government tightens COVID-19-related entry restrictions for certain travelers from March 8 /update 41,https://crisis24.garda.com/insights-intelligence/intelligence/risk-alerts/wip10011864042/spain-government-tightens-covid-19-related-entry-restrictions-for-certain-travelers-from-march-8-update-41,,,,
Spain,07-Mar,"In Spain, hugs and sea air for Covid survivor ",https://www.dawn.com/news/1611119,,,,
Spain,07-Mar,Europe holds its breath: Spain rings alarm over TEN different Covid variants,https://www.express.co.uk/news/world/1406542/spain-covid-news-cases-deaths-new-covid-variant-eu-news-covid,,,,
